chrlbl,citations,definition,part_of_speech,word,first_citation_date,first_citation_text,last_citation_date,last_citation_text,family
late 19C,"{'@class': 'new18C', '@first': 'yes', 'date': '1879', 'tit': 'Sporting Times', 'num': '3/2', '#text': '(London) 15 Feb. This deputation about music-halls was simply ‘crass assdom’'}",stupidity as shown by a group of individuals,noun,assdom,1879,(London) 15 Feb. This deputation about music-halls was simply ‘crass assdom’,1879,(London) 15 Feb. This deputation about music-halls was simply ‘crass assdom’,ass
20C+,"[{'@first': 'yes', 'date': '1909', 'aut': 'Joyce', 'src': 'Ellman', 'tit': 'Sel. Letters', 'edn': '1975', 'num': '184', '#text': 'letter 8 Dec. to Nora Barnacle, in  I am delighted to see that you do like being fucked arseways'}, {'date': '1949', 'aut': 'H. Miller', 'tit': 'Sexus', 'edn': '1969', 'num': '58', '#text': 'She was on her hands and knees, begging me to give it to her assways'}]","of sexual intercourse, from the rear",adjective,assways,1909,"letter 8 Dec. to Nora Barnacle, in  I am delighted to see that you do like being fucked arseways",1949,"She was on her hands and knees, begging me to give it to her assways",ass
1910s+,"[{'@class': 'edited', '@first': 'yes', 'date': '1919', 'tit': 'Sketch', 'num': '202/2', '#text': '(London) 107 There’s the rumour of the raiders who ‘bummed’ London having their compasses rendered all assways by ‘Magnetick currents’'}, {'date': '1934', 'aut': 'H. Miller', 'tit': 'Tropic of Cancer', 'edn': '1963', 'num': '93', '#text': 'He stands there with [...] his hat on assways'}, {'@class': 'edited', 'date': '1941', 'aut': 'H. Miller', 'tit': 'Wisdom of the Heart', 'num': '118', '#text': 'That’s civilization — always doing things assways'}, {'date': '1974', 'con': '1945', 'aut': 'E. Thompson', 'tit': 'Tattoo', 'edn': '1977', 'num': '312', '#text': 'They’re [films] supposed to come rewound, but they come ass-to and every whichaway'}, {'@class': 'new17C', 'date': '1996', 'aut': 'P. Howard', 'tit': 'The Joy', 'edn': '2015', '#text': '[ebook] ‘Oh, sorry, I must have got it [i.e. a piece of information] arseways’'}, {'date': '1998', 'aut': 'J. O’Connor', 'tit': 'Salesman', 'num': '194', '#text': 'If things go arseways and if I have to use this [...] then you’ll have to buy it off me'}, {'date': '2000', 'aut': 'F. Mac Anna', 'tit': 'Cartoon City', 'num': '52', '#text': 'Hadn’t she invited him herself. Or had the flower shop lady got it arseways?'}]","skew-whiff, back-to-front",adjective,assways,1919,(London) 107 There’s the rumour of the raiders who ‘bummed’ London having their compasses rendered all assways by ‘Magnetick currents’,2000,Hadn’t she invited him herself. Or had the flower shop lady got it arseways?,ass
1920s,"{'@first': 'yes', 'date': '1922', 'aut': '‘J.H. Ross’', 'tit': 'Mint', 'edn': '1955', 'num': '55', '#text': 'The barman only shook his bloody apron at him, and he went arse-ways on the fucking floor'}",head-over-heels,adjective,assways,1922,"The barman only shook his bloody apron at him, and he went arse-ways on the fucking floor",1922,"The barman only shook his bloody apron at him, and he went arse-ways on the fucking floor",ass
1940s,"{'@first': 'yes', 'date': '1947–53', 'aut': 'W. Guthrie', 'tit': 'Seeds of Man', 'edn': '1995', 'num': '297', '#text': 'Got it here’n my assways pocket'}","rear, as of a pocket",adjective,assways,1947,Got it here’n my assways pocket,1947,Got it here’n my assways pocket,ass
1980s+,"[{'@first': 'yes', 'date': '1989–2003', 'aut': 'R.O. Scott', 'tit': 'Gay Sl. Dict.', 'i': 'assy', '#text': '[Internet] : bitch, nasty'}, {'date': '1990', 'aut': 'J. Naidoo', 'tit': 'Coolie Location', 'num': '66', '#text': '‘I’ll get you!’ I threatened. ‘You won’t get me nothing, you assy Parker!’'}]","malicious, sarcastic",adjective,assy,1989,"[Internet] : bitch, nasty",1990,"‘I’ll get you!’ I threatened. ‘You won’t get me nothing, you assy Parker!’",ass
2000s,"{'@first': 'yes', 'date': '2000', 'tit': ['Ebonics Primer', 'www.dolemite.com'], 'b': 'assy', 'i': 'Yo, that ugly skank ho o’er dere is assy. I wouldn’t do her for all the Jack Daniels in Tennesee', '#text': 'at  [Internet]  Definition: in the condition of being a fool/small time Example:'}","insignificant, second-rate, unimportant",adjective,assy,2000,at  [Internet]  Definition: in the condition of being a fool/small time Example:,2000,at  [Internet]  Definition: in the condition of being a fool/small time Example:,ass
2000s+,"{'@class': 'new', '@first': 'yes', 'date': '2013', 'aut': 'J. Stahl', 'tit': 'Happy Mutant Baby Pills', 'num': '122', '#text': 'They mad-dogged us and then the boy grabbed one of his chiquita’s butt cheeks [...] Nora slid her eyes my way and shrugged. ‘Some guys like ’em assy’'}",having large or prominent buttocks,adjective,assy,2013,They mad-dogged us and then the boy grabbed one of his chiquita’s butt cheeks [...] Nora slid her eyes my way and shrugged. ‘Some guys like ’em assy’,2013,They mad-dogged us and then the boy grabbed one of his chiquita’s butt cheeks [...] Nora slid her eyes my way and shrugged. ‘Some guys like ’em assy’,ass
1920s+,"[{'@class': 'uk', 'pre': '1893', 'aut': 'J. Salisbury', 'tit': 'Gloss. Words S.E. Worcs', 'num': '13', 'i': 'Assud-backuds', '#text': ', hind before ]'}, {'@class': 'edited', '@first': 'yes', 'date': '1929', 'aut': 'Rabelais', 'tit': 'All Extant Works: An American Translation', 'num': '55', '#text': 'I hope you drink so much you tumble over arse-backwards'}, {'circa': '1930', 'aut': 'N. Kimball', 'tit': 'Amer. Madam', 'edn': '1981', 'num': '185', '#text': 'His attitude was ass-backwards'}, {'date': '1937', 'tit': 'Hench Collection', 'num': 'n.p.', 'i': 'assbackwards', 'org': 'DARE', '#text': 'I have heard for years in the speech of less polished persons the word  as in ‘He put on his pants assbackwards’'}, {'date': '1943', 'con': '1890s', 'aut': 'W.L. McAtee', 'tit': 'Dial. Grant County', 'num': '2', '#text': '(IN) Suppl  Ass-backwards [...] Extravagance for backwards'}, {'date': '1952', 'aut': 'R. Ellison', 'tit': 'Invisible Man', 'num': '137', '#text': 'We’re an assbackward people'}, {'date': '1958', 'aut': 'L.F. Cooley', 'tit': 'Run For Home', 'edn': '1959', 'num': '106', '#text': 'He’d probably give it to you all ass-backwards!'}, {'date': '1960', 'con': 'WWII', 'aut': 'G. Sire', 'tit': 'Deathmakers', 'num': '216', '#text': 'He spends the rest of his life running around ass-backwards, until he finally disappears up his own asshole'}, {'date': '1960–75', 'tit': 'DARE', '#text': 'in'}, {'@class': 'N331', 'date': '1962', 'con': 'WWII', 'aut': 'J.O. Killens', 'tit': 'And Then We Heard The Thunder', 'edn': '1964', 'num': '87', '#text': 'You got everything ass-backwards'}, {'date': '1966', 'aut': 'C. Himes', 'tit': 'Run Man Run', 'edn': '1969', 'num': '94', '#text': 'I do eveything ass backwards, don’t I?'}, {'@class': 'N331', 'date': '1972', 'aut': 'R.A. Wilson', 'tit': 'Playboy’s Book of Forbidden Words'}, {'date': '1978', 'aut': 'J. Webb', 'tit': 'Fields of Fire', 'edn': '1980', 'num': '27', '#text': '‘You in the Marines?’ [...] ‘Nope, not yet.’ [...] ‘Ain’t this kind of ass-backwards?’'}, {'date': '1983', 'aut': 'N. Heard', 'tit': 'House of Slammers', 'num': '118', '#text': 'That seems a bit ass-backwards, as I see it'}, {'date': '1986', 'aut': 'L. Heinemann', 'tit': 'Paco’s Story', 'edn': '1987', 'num': '126', '#text': 'I don’t fly it right side up, upside down, inside out, crosswise, ass backward, or fuck-you otherwise'}, {'date': '1991', 'aut': 'D. Simon', 'tit': 'Homicide', 'edn': '1993', 'num': '224', '#text': 'A dozen or more .38-caliber rounds, most of them ass-backwards wadcutters'}, {'date': '1999', 'aut': '‘Punctured Bicycle’', '#text': '14 Nov. [email] Most humans on this arse backwards planet will not know what the hell to do with him, others love him intensely'}, {'date': '2002', 'aut': 'J. Lerner', 'tit': 'You Got Nothing Coming', 'num': '194', '#text': 'I exit the cell ass-backward, crashing into the moo cop who has run up the tier'}, {'date': '2002', 'aut': 'M. Rogers', '#text': '[blog] 9 May Anyway, this guy’s done some academic work demonstrating how arse-backwards conservative voting patterns actually are'}, {'@class': 'N331', 'date': '2002', 'aut': '‘Touré’', 'tit': 'Portable Promised Land', 'num': '160', '#text': '(ms.) We Words (My Favorite Things) [...] Assbackwards'}, {'@class': 'edited', 'date': '2010', 'aut': 'A. Steinberg', 'tit': 'Running the Books', 'num': '82', '#text': ""I’d kick myself in the ass, ass backwardz if I didn't attempt to get the goodz, knowin’ that I wanted a piece of the pie""}, {'@class': 'new17B', 'date': '2017', 'tit': 'Twitter', '#text': '14 May [Internet] There is no way you’re a millennial with that 1950s assbackwards way of thinking'}]","back-to-front; thus fig., in a mess, chaotic",compound,ass-backwards,1893,", hind before ]",2017,14 May [Internet] There is no way you’re a millennial with that 1950s assbackwards way of thinking,ass
2000s,"{'@class': 'edited', '@first': 'yes', 'date': '2008', 'aut': 'G. Pelecanos', 'tit': 'Way Home', 'edn': '2009', 'num': '157', '#text': 'Chris and Ben would be ass-broke and back at work at seven in the morning'}",totally impoverished,phrase,ass-broke,2008,Chris and Ben would be ass-broke and back at work at seven in the morning,2008,Chris and Ben would be ass-broke and back at work at seven in the morning,ass
None,"[{'@class': 'edited', '@first': 'yes', 'date': '1940', 'aut': 'E. O’Brien', 'tit': 'One Way Ticket', 'num': '13', '#text': 'Here we are [...] with the wind blowin’ like a bat outa hell and snow ass-deep to a tall Indian'}, {'@class': 'edited', 'date': '1956', 'aut': 'V. Fisher', 'tit': 'Pemmican', 'num': '128', '#text': 'When we invade the Athabasca we’re going to be in trouble ass deep to a moose'}, {'date': '1960', 'con': '1950', 'aut': 'R. Leckie', 'tit': 'March to Glory', 'edn': '1962', 'num': '192', '#text': 'The snow is ass-deep to a man in a jeep'}, {'@class': 'edited', 'date': '1974', 'aut': 'D. Widener', 'tit': 'N.U.K.E.E.', 'num': '153', '#text': 'Drake was now floundering around the Alaskan wilderness in snow, ass-deep to a tall moose, stuffing thermometers up the butts of wolves'}, {'@class': 'edited', 'date': '1983', 'aut': 'J.Y. Glimm', 'tit': 'Flatlanders and Ridgerunners', 'num': '23', '#text': 'The snow was ass deep to a tall Indian'}, {'@class': 'edited', 'date': '2002', 'aut': 'M. Evans', 'tit': 'Madame Millie', 'num': '147', '#text': 'Snow was ass deep to a giraffe, and the wind was blowing all the way from the North Pole'}]",very deep; usu. in such phrs. as,compound,ass deep,1940,Here we are [...] with the wind blowin’ like a bat outa hell and snow ass-deep to a tall Indian,2002,"Snow was ass deep to a giraffe, and the wind was blowing all the way from the North Pole",ass
,"[{'@first': 'yes', 'date': '1958', 'aut': 'E. Gilbert', 'tit': 'Vice Trap', 'num': '75', '#text': 'She used to be ass deep in codein [sic] and bennies'}, {'date': '1961', 'aut': 'G.L. Coon', 'tit': 'Meanwhile, Back at the Front', 'edn': '1962', 'num': '37', '#text': 'I’m going to be ass-deep in rolling heads before I’m through here'}, {'date': '1972', 'aut': 'D. Jenkins', 'tit': 'Semi-Tough', 'num': '167', '#text': '[He] is gonna get himself ass-deep in so much young Scotch that this palatial suite of ours better be able to float'}]","totally involved with, with an excessive amount of",compound,ass deep,1958,She used to be ass deep in codein [sic] and bennies,1972,[He] is gonna get himself ass-deep in so much young Scotch that this palatial suite of ours better be able to float,ass
1970s+,"[{'@class': 'edited', '@first': 'yes', 'date': '1971', 'aut': 'T. Witmore', 'tit': 'Memphis-Nam-Sweden', 'num': '59', '#text': 'That was too much for a bunch of starving, combat-beat-to-the-ass-dragging grunts'}, {'date': '1993', 'aut': 'J. Mowry', 'tit': 'Six Out Seven', 'edn': '1994', 'num': '453', '#text': 'Ass-draggin stationwagon, but it kinda give ’em class'}]","run-down, worn out",compound,ass-dragging,1971,"That was too much for a bunch of starving, combat-beat-to-the-ass-dragging grunts",1993,"Ass-draggin stationwagon, but it kinda give ’em class",ass
1960s,"{'@first': 'yes', 'date': '1967', 'tit': 'DARE', '#text': 'in  questionaire'}",head-over-heels,compound,ass-frontwards,1967,in  questionaire,1967,in  questionaire,ass
1960s–70s,"[{'@class': 'edited', '@first': 'yes', 'date': '1964', 'tit': 'Burning Water', 'num': '17', '#text': '2 It’s as if all were ass-frontwards'}, {'@class': 'edited', 'date': '1972', 'aut': 'J. Mekas', 'tit': 'Movie Jrnl', 'num': '3', '#text': 'The mutilation of Max Ophuls’ Lola Montes, cut from its original 140 minutes to 90 minutes [...] plus being twisted ass-frontwards in a frantic attempt to make it look like a conventional film'}]",back-to-front,compound,ass-frontwards,1964,2 It’s as if all were ass-frontwards,1972,"The mutilation of Max Ophuls’ Lola Montes, cut from its original 140 minutes to 90 minutes [...] plus being twisted ass-frontwards in a frantic attempt to make it look like a conventional film",ass
1960s,"{'@first': 'yes', 'date': '1965', 'aut': 'C.D. Bryan', 'tit': 'P.S. Wilkinson', 'num': '82', '#text': 'You’ll never even get a cent of your precious ass-grabbing pension!'}",irritating,compound,ass-grabbing,1965,You’ll never even get a cent of your precious ass-grabbing pension!,1965,You’ll never even get a cent of your precious ass-grabbing pension!,ass
1950s+,"[{'@first': 'yes', 'date': '1956', 'aut': 'N. Algren', 'tit': 'Walk on the Wild Side', 'num': '161', 'i': 'are', '#text': '‘How tall  you, Shorty?’ [...] ‘About ass-high to a tall Indian.’'}, {'@class': 'edited', 'date': '1961', 'aut': 'J. Hoffenberg', 'tit': 'Sow Not in Anger', 'num': '422', '#text': 'I was about ass-high to a three-foot midget, I guess'}, {'@class': 'edited', 'date': '1974', 'aut': 'T. Kidder', 'tit': 'Road to Yuba City', 'num': '265', '#text': 'A forced march over mountains covered with snow that was ‘ass-high to a tall monkey’'}, {'@class': 'edited', 'date': '1985', 'aut': 'I. Doig', 'tit': 'English Creek', 'num': '61', '#text': 'A million dollar rain, ain’t it? Brought the grass up ass-high to a tall Indian'}, {'@class': 'edited', 'date': '2006', 'aut': 'J. Larimer', 'tit': 'Pretender Lamb', 'num': '147', '#text': 'January days when the snow is ‘ass high to a giraffe’'}]",an unspecified measure of height; usu. as,compound,ass-high,1956,"‘How tall  you, Shorty?’ [...] ‘About ass-high to a tall Indian.’",2006,January days when the snow is ‘ass high to a giraffe’,ass
2000s,"{'@class': 'edited', '@first': 'yes', 'date': '2002', 'aut': 'Simon & Burns', 'tit': 'Wire', '#text': '‘The Target’ ep. 1 [TV script] What would an ass-ignorant motherfucker like you do with a computer?'}",extremely stupid,compound,ass-ignorant,2002,‘The Target’ ep. 1 [TV script] What would an ass-ignorant motherfucker like you do with a computer?,2002,‘The Target’ ep. 1 [TV script] What would an ass-ignorant motherfucker like you do with a computer?,ass
None,"[{'@first': 'yes', 'date': '1997–2001', 'tit': 'Online Sl. Dict.', '#text': '[Internet] ass out adj 2. out of luck. (‘I’m afraid that you’re just ass out.’)'}, {'date': '1999', 'aut': 'J. Ridley', 'tit': 'Everybody Smokes in Hell', 'num': '131', '#text': '‘How you know he ain’t gonna roll?’ ‘He’s ass-out.’'}]","at the end of one’s tether; beyond effort, without luck (cf. )",compound,ass-out,1997,[Internet] ass out adj 2. out of luck. (‘I’m afraid that you’re just ass out.’),1999,‘How you know he ain’t gonna roll?’ ‘He’s ass-out.’,ass
,"{'@first': 'yes', 'date': '1995', 'aut': 'L. Stavsky', 'tit': 'A2Z', 'num': '2', 'i': 'ass-out', '#text': 'et al. ass-out – straight out: The test was  easy'}","straighforward, easy",compound,ass-out,1995,et al. ass-out – straight out: The test was  easy,1995,et al. ass-out – straight out: The test was  easy,ass
,"{'@first': 'yes', 'date': '1997–2001', 'tit': 'Online Sl. Dict.', '#text': '[Internet] ass out adj 1. without money; BROKE. (‘I can’t go to the show tonight, I’m ass out.’)'}",without money,compound,ass-out,1997,"[Internet] ass out adj 1. without money; BROKE. (‘I can’t go to the show tonight, I’m ass out.’)",1997,"[Internet] ass out adj 1. without money; BROKE. (‘I can’t go to the show tonight, I’m ass out.’)",ass
1960s,"{'@first': 'yes', 'date': '1960', 'aut': 'C. Cooper Jr', 'tit': 'Scene', 'edn': '1996', 'num': '243', '#text': 'I know the Feds are doing an ass-tight job, holding the stuff down'}","in fig. use, very efficient",compound,ass-tight,1960,"I know the Feds are doing an ass-tight job, holding the stuff down",1960,"I know the Feds are doing an ass-tight job, holding the stuff down",ass
,"{'@first': 'yes', 'date': '1967', 'aut': 'P. Thomas', 'tit': 'Down These Mean Streets', 'edn': '1970', 'num': '121', 'i': 'amigos', '#text': 'The dozens is a dangerous game even among friends, and many a tooth has been lost between fine, ass-tight'}","of friends, very intimate",compound,ass-tight,1967,"The dozens is a dangerous game even among friends, and many a tooth has been lost between fine, ass-tight",1967,"The dozens is a dangerous game even among friends, and many a tooth has been lost between fine, ass-tight",ass
1990s+,"[{'@first': 'yes', 'date': '1997', 'aut': 'Simon & Burns', 'tit': 'Corner', 'edn': '1998', 'num': '121', '#text': 'R.C., your shit is ass-ugly'}, {'@class': 'edited', 'date': '1999', 'aut': 'M. Haynes', 'tit': 'Mother of Pearl', 'num': '135', '#text': 'She must be one ass-ugly woman, you wantin’ to run out so fast and all'}, {'@class': 'edited', 'date': '2010', 'aut': 'C. Cummings', 'tit': 'On Being', 'num': '11', '#text': '[He] fires you because he didn’t like the comment you made about the ass-ugly chairs he put in my office?'}, {'@class': 'edited', 'date': '2011', 'aut': 'A. Dante', 'tit': 'La Faiglia Bianco', 'num': '363', '#text': 'You better dump that fat ass-ugly crazy bitch, kid or no kid'}]",very unattractive,compound,ass-ugly,1997,"R.C., your shit is ass-ugly",2011,"You better dump that fat ass-ugly crazy bitch, kid or no kid",ass
1960s+,"{'@first': 'yes', 'date': '1985', 'con': '1968', 'aut': 'D.A. Dye', 'tit': 'Citadel', 'edn': '1989', 'num': '133', '#text': 'Listen, ass-bag'}",a derog. term of abuse,compound,ass-bag,1985,"Listen, ass-bag",1985,"Listen, ass-bag",ass
1950s+,"[{'@first': 'yes', 'date': '1955', 'aut': 'J.W. Ellson', 'tit': 'I’m Owen Harrison Harding', 'num': '182', '#text': 'Owen Harding [...] The old reliable ass bandit!'}, {'@class': 'edited', 'date': '1968', 'aut': 'C. Brown', 'tit': 'Disciple', 'num': '25', '#text': 'I think she’d like it if I was a big lover and seduced a lot of women, a real ass bandit, you know?'}, {'date': '1978', 'tit': 'Maledicta', 'num': '118', 'i': ['ass-bandit', 'molrower', 'swive', 'Athenian', 'ell'], '#text': 'II:1+2 (Summer/Winter) He misses [...] , formerly  (now obsolete, like so many other vivid sex terms: , , , etc.)'}, {'@class': 'edited', 'date': '1991', 'aut': 'T. Kakonis', 'tit': 'Double Down', 'num': '181', '#text': 'That line a work you’d be a regular ass bandit. More tail’n you could shake your schwantz at'}]","a womanizer, a playboy",compound,ass bandit,1955,Owen Harding [...] The old reliable ass bandit!,1991,That line a work you’d be a regular ass bandit. More tail’n you could shake your schwantz at,ass
1970s+,"{'@first': 'yes', 'date': '1972', 'tit': 'End Zone', 'num': '117', '#text': 'Delillo That ass-belly sixty-two got his first in'}",a grotesquely fat person,compound,ass-belly,1972,Delillo That ass-belly sixty-two got his first in,1972,Delillo That ass-belly sixty-two got his first in,ass
2000s,"{'@first': 'yes', 'date': '2000', 'tit': 'Other Side of the Wall: Prisoner’s Dict.', '#text': 'July [Internet] Ass Betting: Gambling without any funds or means of paying back one’s loses'}",gambling without means of paying back one’s losses,compound,ass betting,2000,July [Internet] Ass Betting: Gambling without any funds or means of paying back one’s loses,2000,July [Internet] Ass Betting: Gambling without any funds or means of paying back one’s loses,ass
1970s+,"[{'@class': 'new', 'pre': '1835', 'tit': ['Rumcodger’s Coll.', 'Bawdy Songbooks'], 'src': 'Spedding & Watt', 'edn': '2011', 'num': '265', '#text': '‘John and the Maid’ in in (eds) IV With his spur up, prick up, he did kick up, / All the stones, to ass bones, she she cried, ‘pray do go on’]'}, {'@first': 'yes', 'date': '1972', 'aut': 'D. Pearce', 'tit': 'Pier Head', 'num': '32', '#text': 'Before some other idiot breaks his goddam assbone'}, {'date': '1999', 'tit': 'www.sexdrip.com', '#text': '[Internet] [headline] Ram My Assbone Bone My Tight Virgin Ass!!'}, {'date': '2001', 'aut': 'J. Stahl', 'tit': 'Plainclothes Naked', 'edn': '2002', 'num': '125', '#text': 'Two broken shoulders, half his teeth smashed, and a busted ass-bone'}, {'date': '2002', 'tit': 'www.thechraveler.com', '#text': 'Jan. [Internet] If you and your buddies were barracho one night and decided to go pool hopping, you’d have about a 50-50 chance of cannonballing blindly into the wrong pool and breaking your assbone'}, {'@class': 'edited', 'date': '2009', 'aut': 'D. Black', 'tit': 'Just a Baby', 'num': '230', '#text': 'If you so much as look at her crooked, my foot bone will unite with your ass bone'}, {'@class': 'new', 'date': '2009', 'aut': 'P. Temple', 'tit': 'Truth', 'num': '77', '#text': 'He’s on his arsebone in the Bekaa Valley, snorting Cloud Nine'}]",the buttocks; the coccyx; thus  v,compound,assbone,1835,"‘John and the Maid’ in in (eds) IV With his spur up, prick up, he did kick up, / All the stones, to ass bones, she she cried, ‘pray do go on’]",2009,"He’s on his arsebone in the Bekaa Valley, snorting Cloud Nine",ass
1980s+,"[{'@first': 'yes', 'date': '1989–2003', 'aut': 'R.O. Scott', 'tit': 'Gay Sl. Dict.', '#text': '[Internet]'}, {'date': '2002', 'tit': 'gaymen.exyahoo.com', '#text': '[Internet] Access Instantly with Gay MAN Hot Sex! assboy'}]",a male homosexual,compound,ass boy,1989,[Internet],2002,[Internet] Access Instantly with Gay MAN Hot Sex! assboy,ass
1940s+,"[{'@first': 'yes', 'date': '1962', 'con': 'WWII', 'aut': 'J. Jones', 'tit': 'Thin Red Line', 'edn': '1963', 'num': '37', '#text': 'Well, here’s a real ass-breaker. I sure can collect them'}, {'date': '1976', 'tit': 'Rolling Stone', 'num': 'n.p.', '#text': 'in  20 May No. 216 I did it once. It was ass-breaker. You work yourself to death'}, {'date': '1991', 'aut': 'B. Duffy', 'tit': 'Head Count', 'num': '152', '#text': 'That’s an ass-breaker for an old man'}, {'@class': 'edited', 'date': '2001', 'aut': 'W. Lawson', 'tit': 'Praetorian Condition', 'num': '268', '#text': 'It’s [i.e. a climb] going to be a goddamn ass-breaker [...] It’s going to be hard'}]","a difficult, boring or exasperating job, problem or situation",compound,ass-breaker,1962,"Well, here’s a real ass-breaker. I sure can collect them",2001,It’s [i.e. a climb] going to be a goddamn ass-breaker [...] It’s going to be hard,ass
1960s,"{'@first': 'yes', 'date': '1966', 'tit': 'DARE', '#text': 'in'}","a dive in which the diver lands stomach down on the water, rather than cutting through it",compound,ass-breaker,1966,in,1966,in,ass
1960s,"{'@first': 'yes', 'date': '1966', 'aut': 'R. Giallombardo', 'tit': 'Study of a Women’s Prison', 'num': '200', '#text': 'Gloss. in Ass Breaker. [...] a strict disciplinarian'}","a severe, authoritarian guard",compound,ass-breaker,1966,Gloss. in Ass Breaker. [...] a strict disciplinarian,1966,Gloss. in Ass Breaker. [...] a strict disciplinarian,ass
2000s,"{'@first': 'yes', 'date': '2001', 'tit': 'FilmScore Monthly', '#text': '[Internet] In the film, Dingus Magee (Frank Sinatra) is making a living as an ass-breaker when he encounters old acquaintance Herkimer ‘Hoke’ Birdsill (George Kennedy)'}",a thug,compound,ass-breaker,2001,"[Internet] In the film, Dingus Magee (Frank Sinatra) is making a living as an ass-breaker when he encounters old acquaintance Herkimer ‘Hoke’ Birdsill (George Kennedy)",2001,"[Internet] In the film, Dingus Magee (Frank Sinatra) is making a living as an ass-breaker when he encounters old acquaintance Herkimer ‘Hoke’ Birdsill (George Kennedy)",ass
2000s,"{'@first': 'yes', 'date': '2002', 'tit': 'Sex, Sex Humor and Sexuality', '#text': '‘Gang Rape’ in  [Internet] ‘Come on Chuckie, get out. She’s had enough of your ass breaker.’ Chuckie slowly withdrew'}",the penis,compound,ass-breaker,2002,"‘Gang Rape’ in  [Internet] ‘Come on Chuckie, get out. She’s had enough of your ass breaker.’ Chuckie slowly withdrew",2002,"‘Gang Rape’ in  [Internet] ‘Come on Chuckie, get out. She’s had enough of your ass breaker.’ Chuckie slowly withdrew",ass
1990s+,"{'@first': 'yes', 'date': '1999', 'aut': 'S. King', 'tit': 'Hearts in Atlantis', 'edn': '2000', 'num': '446', '#text': 'Suck me sideways, ass-breath'}",a derog. term of address,compound,ass-breath,1999,"Suck me sideways, ass-breath",1999,"Suck me sideways, ass-breath",ass
