chrlbl,citations,definition,part_of_speech,word,first_citation_date,first_citation_text,last_citation_date,last_citation_text,family
late 17C+,"[{'@first': 'yes', 'date': '1676', 'aut': 'Wycherley', 'tit': 'Plain-Dealer', 'num': 'I i', 'i': 'Jack', '#text': 'Here’s a finical Fellow ! What a brave fair weather Captain of a Ship he wou’d make!'}, {'date': '1707', 'aut': 'N. Ward', 'tit': 'Wooden World', 'num': '94', 'i': 'Jack', '#text': 'Let us e’en turn about, and view honest  the Sailor'}, {'circa': '1720', 'aut': 'Holloway & Black', 'edn': '1975', 'num': '177', '#text': '‘Merchant’s Courtship . . .’ in  I And Jack he heard of another pretty fancy'}, {'date': '1772', 'aut': 'Bridges', 'tit': 'Burlesque Homer', 'edn': '3rd edn', 'num': '282', '#text': 'Which when some honest tar shall see / [...] / Thus to himself poor Jack will cry'}, {'circa': '1780', 'aut': 'Holloway & Black', 'edn': '1975', 'num': '237', '#text': '‘Sailor’s Frolick’ in  I For white wine and canary, poor Jack must pay for all'}, {'ante': '1790', 'aut': 'C. Dibdin', 'tit': 'Collection of Songs', 'num': '115', '#text': '‘True English Sailor’ in  II Jack dances and sings, and is always content'}, {'date': '1800', 'tit': 'Jovial Songster', 'num': '50', '#text': '‘Signal’s Gave’ in Jack sings yo heave ho, / He braves the dangers of the main'}, {'date': '1817', 'aut': 'J.T. Smith', 'tit': 'Vagabondiana', 'num': '25', '#text': 'My worthy heart, stow a copper in Jack’s locker – for poor Jack has not had a quid to-day'}, {'@class': 'N331', 'date': '1821', 'aut': 'Egan', 'tit': 'Life in London', 'edn': '1869', 'num': '320', '#text': 'For after all is said and done, / Fighting’s to Jack the same as fun'}, {'date': '1827', 'aut': 'P. Cunningham', 'tit': 'New South Wales', 'num': '273', '#text': 'II Jack, as soon as tired of the ‘happy state,’ would take to ship again'}, {'date': '1837', 'aut': 'C. Hindley', 'tit': 'Curiosities of Street Lit.', 'edn': '1871', 'num': '57', '#text': '‘Sailor Jack and Queen Victoria’ in Now Jack, who’d travelled far away / Returned to port the other day'}, {'@class': 'N331', 'date': '1841', 'aut': 'F.L.G.', 'tit': 'Swells Night Out', 'num': 'n.p.', '#text': 'It is not an unusual thing to witness Jack with a doxy on each knee here'}, {'@class': 'N331', 'date': '1841', 'aut': 'C. Hindley', 'tit': 'Curiosities of Street Lit.', 'edn': '1871', 'num': '64', '#text': '‘Birth of a Prince of Wales’ in Says Jack, when he beheld the boy, / ‘Your Majesty, I wish you joy.’'}, {'date': '1849', 'aut': 'J.P. Townsend', 'tit': 'Rambles in New South Wales', 'num': '274', 'i': 'is', '#text': 'There  a sweet little cherub that sits up above, to look out for the life of poor Jack'}, {'date': '1859', 'aut': 'G.A. Sala', 'tit': 'Gaslight and Daylight', 'num': '42', '#text': '‘Jack’ (alluding, under that cognomen, to the general ‘seafaring’ class)'}, {'date': '1866', 'tit': 'Night Side of N.Y.', 'num': '29', '#text': 'The crimps have their strong-hold here, and Jack’s hard-earned wages [...] is the in-flowing capital upon which these sharks carry on their infamous calling [...] Jack ashore has long been notable for his tendency to indulge in the lively dance'}, {'@class': 'new', 'date': '1880', 'tit': 'Bulletin', 'num': '4/4', 'i': 'Bread unfit for human food', '#text': '(Sydney) 2 Oct. ‘Good enough for sailors!’ /  / Bitter, sour, baked quite black, / That bread’s good enough for ‘Jack’!'}, {'@class': 'new17B', 'date': '1884', 'tit': 'Ally Sloper’s Half Holiday', 'num': '63/2', '#text': '21 June Wicked men, called navy agents, hung around and touted for Jack, to whom they advanced certain sums of money'}, {'@class': 'new', 'date': '1894', 'tit': 'Truth', 'num': '6/7', '#text': '(Sydney) 7 Oct. Jack ashore [...] is proverbially free-handed and generous in ‘shouting’ for all and sundry'}, {'date': '1895', 'aut': 'E. Townsend', 'tit': 'Chimmie Fadden Explains', 'num': '205', '#text': 'The orders came from Headquarters to keep the women out of the saloons there for the protection of Jack ashore'}, {'date': '1898', 'aut': 'H.H. Lewis', 'tit': 'A Gunner Aboard the ‘Yankee’', 'num': '9', '#text': 'We became full-fledged ‘Jackies’'}, {'@class': 'new', 'date': '1898', 'tit': 'W.A. Sun. Times', 'num': '2/1', '#text': '(Perth) 23 Jan. No longer can the loafer, the shiftless, or the criminal pose as a decent ‘Jack’ down on his luck'}, {'date': '1900', 'tit': 'Punch', 'num': '64/1', '#text': '24 Jan. While we proudly tell of TOMMY’S pluck, / And of JACK the handy man of war, / Of Cornstalk ready, and keen Canuck'}, {'@class': 'new18B uk', 'date': '1900', 'aut': 'E.W. Rogers', 'tit': 'The Red and The White and The Blue', '#text': ""[perf. Marie Lloyd]  [lyrics] And they catch a glimpse of colour through the kitchen window-pane, / Of their girl with Jack and Tommy, then they say, We'll call again""}, {'@class': 'N331', 'date': '1894', 'aut': 'A. Morrison', 'tit': 'Tales of Mean Streets', 'edn': '1983', 'num': '69', '#text': 'He wore the high-crowned peaked cap topped with a knob of wool, which is affected by Jack ashore about the docks'}, {'date': '1907', 'aut': 'D. Runyon', 'tit': 'From First to Last', 'edn': '1954', 'num': '31', '#text': '‘Fat Fallon’ in They were a bunch of jackies from the Olympia under a lieutenant'}, {'date': '1910', 'tit': 'Bulletin', 'num': '11/1', '#text': '(Sydney) 22 Sept. Jack at sea and Tom in barrack / Got blind drunk on rum or arrack'}, {'@class': 'new', 'date': '1913', 'aut': 'T.A. Dorgan', 'tit': 'Daffydils', '#text': '3 Jan. [synd. cartoon strip] If a jackie on a battleship was promised promotion for a brave act, would the target it?'}, {'date': '1914', 'aut': 'G.D. Chase', 'tit': 'DN', 'num': '150', 'b': 'jackshite', 'i': 'n', '#text': '‘Navy Sl.’ in  IV: ii , . A blue jacket'}, {'@class': 'N331', 'date': '1916', 'aut': '‘A-No. 1’', 'tit': 'Snare of the Road', 'num': '106', '#text': '‘Hy there, Jack!’ the bluecoat shouted to the marine'}, {'@class': 'new18A', 'date': '1916', 'aut': '‘Anzac’', 'tit': 'On the Anzac Trail', 'num': '127', '#text': 'hey were white right through, those boys from the warships, from the plucky little middies and the jolly ‘Jacks’ right up to the senior officers'}, {'date': '1916', 'aut': 'C. Sandburg', 'tit': 'Chicago Poems', 'num': '88', '#text': '‘Iron’  Straight, shining, polished guns, / Clambered over with jackies in white blouses, / Glory of tan faces, tousled hair, white teeth, / Laughing lithe jackies in white blouses'}, {'date': '1926', 'aut': 'Wood & Goddard', 'tit': 'Dict. Amer. Sl.'}, {'@class': 'N331', 'date': '1932', 'con': '1919', 'aut': 'Dos Passos', 'tit': ['Nineteen Nineteen', 'USA'], 'edn': '1966', 'num': '358', '#text': 'in So you were in the navy, were you? I thought you looked more like a jackie than a merchant seaman'}, {'date': '1933', 'con': 'late 19C', 'aut': 'F. Riesenberg', 'tit': 'Log of the Sea', 'num': '19', '#text': 'A nice new-looking pilot jacket, recently hocked by a jack tar [...] ‘Some hard-up jackie parted with that for two dollars’'}, {'date': '1943', 'aut': 'M. Harrison', 'tit': 'Reported Safe Arrival', 'num': '131', '#text': 'Yer can’t muck abaht wiv the Navy. They’re good lads, the Jacks is!'}, {'@class': 'new18B', 'date': '1945', 'aut': 'H.B. Darrach', 'tit': 'Baltimore Sun', 'num': 'A-1/2', '#text': 'Jr. ‘Sticktown Nocturne’ in (MD) 12 Aug. Rooms upstairs, rents them to Jacks. Hit the beach, maybe thousand [...] of cabbage'}, {'@class': 'new', 'date': '1967', 'aut': 'S. Hugill', 'tit': 'Sailortown', 'num': '4', '#text': 'The sailor ‘on the beach’ automatically became a ‘beachcomber [...] a John who [...] would disappear among the dives of sailortown [and] hide until his ship sailed'}, {'date': '2002', 'aut': 'J. Meades', 'tit': 'Fowler Family Business', 'num': '194', '#text': 'Jacks from Chatham [and] pongos from Brompton Barracks'}]",a sailor,noun,jack,1676,Here’s a finical Fellow ! What a brave fair weather Captain of a Ship he wou’d make!,2002,Jacks from Chatham [and] pongos from Brompton Barracks,jack
late 18C+,"[{'@class': 'us', '@first': 'yes', 'date': '1785', 'aut': 'G. Washington', 'tit': 'Diaries', 'num': '458', '#text': 'II Dispatched at his own reqt. the Spaniard who had the charge of my Jack from Spain'}, {'date': '1829', 'aut': 'T. Hood', 'tit': 'Works', 'edn': '1862', 'num': '310', '#text': '‘Epping Hunt’  II Some long-eared jacks, some knacker’s hacks'}, {'@class': 'new', 'date': '1843', 'aut': 'R.S. Surtees', 'tit': 'Handley Cross', 'edn': '1854', 'num': '79', '#text': 'Three donkeys, two jacks and a jinney'}, {'date': '1864', 'aut': 'Ohio State Board of Agriculture', 'tit': 'Annual Report', 'num': '3', '#text': 'XVIII The class of Jacks and Mules be changed'}, {'@class': 'new17C', 'date': '1892', 'tit': 'L.A. Times', 'num': '11/3', '#text': '9 Dec. Water [...] is [...] packed in on jacks — desert canaries — (of which we are blest in superabundance)'}, {'date': '1908', 'aut': 'L.W. Payne Jr', 'tit': 'DN', 'num': '323', 'b': 'jack', 'i': 'n', '#text': '‘Word-List From East Alabama’ in  III:iv , . [...] 3. A jackass'}, {'date': '1944', 'tit': 'Democrat', 'num': '3/4', 'org': 'DA', '#text': '2 Nov. For Sale — One Tennessee jack, 12 to 14 years old, weight about 700 pounds, $250'}, {'date': '1948', 'aut': 'Randolph & Legman', 'tit': 'Ozark Folksongs and Folklore', 'edn': '1992', 'num': '712', '#text': 'in  II He hazed both his jacks towards Kill-Pecker Creek'}, {'date': '1970', 'aut': 'G. Scott-Heron', 'tit': 'Vulture', 'edn': '1996', 'num': 'ix', '#text': 'There’s a story I heard once about a jackass that was set down squarely between two bales of hay and starved to death. I was just like Jack'}, {'ante': '1986', 'aut': 'G. Logsdon', 'tit': 'Whorehouse Bells Were Ringing', 'edn': '1995', 'num': '82', '#text': '‘Old Zebra Dun’ in Then he said, ‘My jack is weary, there are sev’ral hills to cross. / I want to trade my burro for a gentle riding hawse.’'}]",a donkey or ass,noun,jack,1785,II Dispatched at his own reqt. the Spaniard who had the charge of my Jack from Spain,1986,"‘Old Zebra Dun’ in Then he said, ‘My jack is weary, there are sev’ral hills to cross. / I want to trade my burro for a gentle riding hawse.’",jack
19C,"[{'@first': 'yes', 'date': '1832', 'aut': 'J.P. Kennedy', 'tit': 'Swallow Barn', 'num': '57', 'org': 'DA', '#text': 'I She was usually occupied in paring apples to be baked up into tough jacks for our provender'}, {'@class': 'us', 'date': '1850', 'aut': 'W. Ryan', 'tit': 'Personal Adventures in [...] Calif.', 'num': '238', '#text': 'I Frederic, Halliday, and myself, set to work upon the ‘jacks,’ and soon tossed up a sufficiency for our purpose'}]",a flap,noun,jack,1832,I She was usually occupied in paring apples to be baked up into tough jacks for our provender,1850,"I Frederic, Halliday, and myself, set to work upon the ‘jacks,’ and soon tossed up a sufficiency for our purpose",jack
19C,"{'@first': 'yes', 'date': '1984', 'aut': 'Partridge', 'tit': 'DSUE', 'edn': '8th edn', 'num': '606', '#text': 'C.19–20'}",a -boot,noun,jack,1984,C.19–20,1984,C.19–20,jack
mid-19C+,"[{'@first': 'yes', 'date': '1861', 'con': '1840s–50s', 'aut': 'H. Mayhew', 'tit': 'London Labour and London Poor', 'num': '348/2', '#text': 'IV He had first to remove an iron bar at the first floor landing window to the back, which he did with his jack'}, {'date': '1893', 'aut': 'J. Hawthorne', 'tit': 'Confessions of Convict', 'num': '92', '#text': 'The screw and the jack, the most powerful tools in a burglar’s kit'}, {'date': '1911', 'aut': 'G. Bronson-Howard', 'tit': 'Enemy to Society', 'num': '154', '#text': 'One of them’ll push you, you’ll push him back, an argument’ll start and the first thing you know yuh’re laid out with a jack'}, {'date': '1918', 'aut': 'T.A. Dorgan', 'src': 'Zwilling', 'tit': 'TAD Lex.', 'edn': '1993', 'num': '111', '#text': 'in I had to bounce jack over the guy’s noodle before he’d loosen up'}, {'@class': 'N331', 'date': '1930', 'aut': 'W.R. Burnett', 'tit': 'Iron Man', 'num': '296', '#text': 'You better put that jack away and go lay down some place'}, {'date': '1931', 'aut': 'D. Runyon', 'tit': 'Runyon on Broadway', 'edn': '1954', 'num': '161', '#text': '‘Earthquake’ in He is known to boff guys on their noggins with this jack'}, {'date': '1943', 'aut': 'R. Llewellyn', 'tit': 'None But the Lonely Heart', 'num': '331', '#text': 'Specially them little jobs with the jack'}, {'date': '1950', 'aut': 'Goldin', 'tit': 'DAUL', 'num': '109/1', '#text': 'et al. Jack, n. 1. A blackjack'}, {'date': '1967', 'aut': 'S. Harris', 'tit': 'Hellhole', 'num': '151', '#text': 'in And he hit her on the behind with his jack'}, {'date': '1973', 'aut': 'J.B. Rubinstein', 'tit': 'City Police', 'num': '334', '#text': 'Each one with a hand on a gun, ready to reach for a jack if someone gives him ‘some shit’'}]",a black or cosh,noun,jack,1861,"IV He had first to remove an iron bar at the first floor landing window to the back, which he did with his jack",1973,"Each one with a hand on a gun, ready to reach for a jack if someone gives him ‘some shit’",jack
late 19C,"{'@first': 'yes', 'date': '1984', 'aut': 'Partridge', 'tit': 'DSUE', 'edn': '8th edn', 'num': '606', '#text': 'from ca. 1890'}",a al,noun,jack,1984,from ca. 1890,1984,from ca. 1890,jack
20C+,"[{'@first': 'yes', 'circa': '1900', 'aut': 'F. Rickaby', 'tit': 'Ballads and Songs of the Shanty-Boy', 'edn': '1926', 'num': '97', 'org': 'DA', '#text': 'Every jack’s a cant-hook man; no others can be found. They do some heavy loggin’, but they do it best in town'}, {'date': '1931', 'aut': 'J. Stevens', 'src': 'Botkin', 'tit': 'Folk-Say', 'num': '125', '#text': '‘Fisherman’s Paradise’ in Paul Bunyan’s ’jacks were exhausted by the hardest log drive of timber-county history'}, {'date': '1947', 'tit': 'Sat. Eve. Post', 'num': '20/1', 'org': 'DA', '#text': '8 Mar. The red-bearded jack came on again, head low and shielded'}]",a lumber,noun,jack,1900,"Every jack’s a cant-hook man; no others can be found. They do some heavy loggin’, but they do it best in town",1947,"8 Mar. The red-bearded jack came on again, head low and shielded",jack
1900s–10s,"{'@first': 'yes', 'date': '1905', 'aut': 'H. Green', 'tit': 'Actors’ Boarding House', 'edn': '1906', 'num': '105', '#text': 'Smith’s friend won the first jack'}",a pot,noun,jack,1905,Smith’s friend won the first jack,1905,Smith’s friend won the first jack,jack
1960s,"{'@first': 'yes', 'date': '1962', 'aut': 'F. Norman', 'tit': 'Guntz', 'num': '88', '#text': 'Like all that leather jack jazz'}",a et,noun,jack,1962,Like all that leather jack jazz,1962,Like all that leather jack jazz,jack
early 19C,"[{'@first': 'yes', 'date': '1812', 'aut': 'Vaux', 'tit': 'Vocab. of the Flash Lang.'}, {'date': '1823', 'aut': 'Egan', 'tit': 'Grose’s Classical Dict. of the Vulgar Tongue'}]","a post-chaise, a travelling carriage seating two or four, with the coachman or postilion riding one of the horses",noun,jack,1812,,1823,,jack
1920s,"{'@class': 'new us', '@first': 'yes', 'date': '1928', 'aut': 'N. White', '#text': '‘Southern Jack’ [lyrics] I got a southern jack, all aboard on the southern jack'}","a locomotive, a railroad train",noun,jack,1928,"‘Southern Jack’ [lyrics] I got a southern jack, all aboard on the southern jack",1928,"‘Southern Jack’ [lyrics] I got a southern jack, all aboard on the southern jack",jack
mid-19C,"{'@class': 'edited', '@first': 'yes', 'date': '1852', 'tit': 'Kendal Mercury', 'num': '6/1', '#text': '17 Apr. To moisten his throttle it vas his delight / An’ jacks of good gatter he’d put out of sight'}","a quart of liquid, usu. alcohol",noun,jack,1852,17 Apr. To moisten his throttle it vas his delight / An’ jacks of good gatter he’d put out of sight,1852,17 Apr. To moisten his throttle it vas his delight / An’ jacks of good gatter he’d put out of sight,jack
mid-19C,"{'@first': 'yes', 'date': '1860', 'aut': 'Hotten', 'tit': 'Dict. of Modern Sl. etc.', 'edn': '2nd edn'}",a low-ranking prostitute,noun,jack,1860,,1860,,jack
mid-19C,"{'@first': 'yes', 'date': '1865', 'tit': 'Leaves from Diary of Celebrated Burglar', 'num': '145/2', '#text': 'Tell Foakstun to goa inti t’ ‘Jack’ an’ waller a piece o’ baccer, an’ thee du t’ saim'}",a lavatory,noun,jack,1865,"Tell Foakstun to goa inti t’ ‘Jack’ an’ waller a piece o’ baccer, an’ thee du t’ saim",1865,"Tell Foakstun to goa inti t’ ‘Jack’ an’ waller a piece o’ baccer, an’ thee du t’ saim",jack
late 19C–1950s,"[{'@first': 'yes', 'date': '1898', 'aut': 'E.E. Morris', 'tit': 'Austral Eng.', 'num': '216', 'org': 'AND', '#text': 'The bird is generally called only a jackass, and this is becoming contracted into the simple abbreviation of Jack'}, {'date': '1901', 'tit': 'Advocate', 'num': '2/4', 'org': 'AND', '#text': '(Burnie) 21 Feb. I brought one of these birds (the Laughing Goburra) over from Victoria a few weeks ago... A snake falling in Jack’s way, it was interesting to watch'}, {'date': '1916', 'tit': 'Bulletin', 'num': '22/1', '#text': '(Sydney) 20 Jan. Can any Abo. brother truthfully say that he has seen a laughing Jack kill a venomous snake?'}, {'date': '1922', 'aut': 'A.D. Mickle', 'tit': 'Wee Dog', 'num': '11', 'org': 'AND', '#text': 'Never was a madder jollification than that of the jacks’ in the great gums'}, {'date': '1936', 'tit': 'Bulletin', 'num': '21/4', '#text': '(Sydney) 1 July Kookaburras would never go for the giant worms [...] We have [...] put them [...] not 19 ft. from a Jack; but he would not have them'}, {'date': '1949', 'aut': 'B. O’Reilly', 'tit': 'Green Mountains', 'num': '136', 'org': 'AND', '#text': 'Mention of Australian birds should begin with the kookaburra. Jack is like the ‘digger’ – the gamest of his tribe'}, {'@class': 'N331', 'date': '1954', 'aut': 'C. Barrett', 'tit': 'Wild Life Aus. and New Guinea', 'num': '120', 'org': 'AND', '#text': '‘Old Jack’, the kookaburra, may have faults, but he has always been a general favourite'}, {'date': '1955', 'aut': 'N. Pulliam', 'tit': 'I Travelled a Lonely Land', 'edn': '1957', 'num': '24', '#text': 'Far from being annoyed with me for leading them on this wild goose chase, Marjorie and Mr Boyd apologized for the jacky’s bad manners, and for the unneighbourly conduct of the platypus'}]",a kookaburra,noun,jack,1898,"The bird is generally called only a jackass, and this is becoming contracted into the simple abbreviation of Jack",1955,"Far from being annoyed with me for leading them on this wild goose chase, Marjorie and Mr Boyd apologized for the jacky’s bad manners, and for the unneighbourly conduct of the platypus",jack
None,"[{'@first': 'yes', 'date': '1886', 'aut': 'W. Newton', 'tit': 'Secrets of Tramp Life Revealed', 'num': '9', '#text': 'Jack or Teck ... Detective'}, {'@class': 'new17C', 'date': '1925', 'tit': 'Smith’s Wkly', 'num': '13/5', '#text': '(Sydney) 11 Apr. I’m in a capital city and none of the jacks know me'}, {'@class': 'new aus', 'date': '1931', 'tit': 'Eve. News', 'num': '3/1', '#text': ""(Rockhampton, Qld) 27 May Other curious names in everyday use' among criminals [are] ‘jacks’ (detectives), and ‘dogs’ (police shadowers, who dog the heels of suspects)""}, {'@class': 'new', 'date': '1936', 'tit': 'Queenslander', 'num': '4/4', '#text': '(Brisbane) 2 July Into the courtroom through a heavy gate / I went. And on the Bench old Bleareyes sate. / A ‘Jack’ steps up and says his piece, / And then His Nibs beefs out my fate'}, {'@class': 'aus', 'date': '1943', 'aut': 'Baker', 'tit': 'AS', 'num': '256', 'i': ['Jacks', 'hammer'], '#text': '‘Influence of American Sl. on Australia’ in  XVIII:4 There’s two on me'}, {'date': '1965', 'con': '1940s', 'aut': 'B. Behan', 'tit': 'Confessions', 'num': '20', '#text': 'Jesus, that’s a funny thing. I’m a Jack myself'}, {'date': '1968', 'aut': 'J. Alard', 'tit': 'He who Shoots Last', 'num': '139', '#text': 'A carload of jacks picked me up [...] Dey wanted some information'}, {'date': '1976', 'aut': 'D. Ireland', 'tit': 'Glass Canoe', 'edn': '1982', 'num': '15', '#text': '‘Your old man isn’t going to like this,’ one of the Jacks said'}, {'@class': 'N331', 'date': '1977', 'aut': 'D. Powis', 'tit': 'Signs of Crime', 'num': '189', '#text': 'Jacks North Country term for junior CID officers'}, {'date': '1980', 'aut': 'J. McClure', 'tit': 'Spike Island', 'edn': '1981', 'num': '83', '#text': 'Black and white, a lot of Uniform work is, not bloody grey like the jacks have to deal with'}, {'date': '1991', 'aut': 'M.B. ‘Chopper’ Read', 'tit': 'Chopper From The Inside', 'num': '197', '#text': 'The Pom was busy cutting toes, / The jacks sat back picking their nose'}, {'date': '2002', 'aut': 'S. Maloney', 'tit': 'Something Fishy', 'edn': '2006', 'num': '231', '#text': 'A homicide cop called Kevin Hayes. One of the many jacks I’d met that morning'}, {'@class': 'new', 'date': '2012', 'aut': 'A. Nette', 'tit': 'Crime Factory: Hard Labour', '#text': '‘Chasing Atlantis’ in  [ebook] ‘He’s a fucking jack,’ said Slade'}]",a detective,noun,jack,1886,Jack or Teck ... Detective,2012,"‘Chasing Atlantis’ in  [ebook] ‘He’s a fucking jack,’ said Slade",jack
,"[{'@first': 'yes', 'date': '1889', 'aut': 'Clarkson & Richardson', 'tit': 'Police!', 'num': '255', '#text': '‘Smoke Jack’ is the name given to the policeman whose special duty it is to note breaches of the Smoke Nuisance Abatement Acts'}, {'date': '1909', 'aut': 'J. Ware', 'tit': 'Passing Eng. of the Victorian Era', 'num': '158/2', 'b': 'Jack', 'i': 'Lambeth', '#text': '(, 1865–72). A policeman – quite local'}, {'date': '1918', 'tit': 'Aussie', 'num': '11/2', '#text': '(France) Sept. We’d choose some big bonza towns where there are no Jacks to hunt us down and where there’s no place Out of Bounds'}, {'date': '1936', 'aut': 'K. Mackenzie', 'tit': 'Living Rough', 'num': '275', '#text': 'You should ’ave seen the fun when the Jacks came [...] I jumped down a fence, I was away to ’ell'}, {'date': '1941', 'aut': 'F. Sargeson', 'tit': 'Coll. Stories', 'edn': '1965', 'num': '192', '#text': '‘That Summer’ in We had to stand there with a crowd of jacks in plain clothes standing round'}, {'date': '1968', 'aut': 'J. Alard', 'tit': 'He who Shoots Last', 'num': '1', '#text': 'The jacks will make it hot for a while'}, {'date': '1984', 'aut': 'Smiley Culture', '#text': '‘Cockney Translation’ [lyrics] What cockney call a Jack’s we call a Blue Bwoy'}, {'date': '1989', 'aut': 'J. Morton', 'tit': 'Lowspeak', 'num': '78', 'i': 'Springheeled Jack', '#text': 'Jack [...] 3. policeman, or detective. When the Liverpool police were investigating the Wallace murder in 1920 [...] they were called Springheeled Jacks [...]  was a well known Victorian melodrama'}, {'date': '1990', 'aut': 'Tupper & Wortley', 'tit': 'Aus. Prison Sl. Gloss.', '#text': '[Internet] Jack. 1. A policeman'}, {'@class': 'N331', 'date': '2000', 'aut': 'N. Griffiths', 'tit': 'Grits', 'num': '326', '#text': 'If anything was ever knocked off in the area the fuckin jacks’d be straight round me bleedin ouse'}, {'date': '2003', 'aut': 'N. Griffiths', 'tit': 'Stump', 'num': '36', '#text': 'Fuckin place is crawlin with jacks'}, {'@class': 'new18D', 'date': '2007', 'aut': 'L. Redhead', 'tit': 'Cherry Pie', '#text': '[ebook] ‘I’ve hated jacks since I got bashed after a demo’'}]",a police officer,noun,jack,1889,‘Smoke Jack’ is the name given to the policeman whose special duty it is to note breaches of the Smoke Nuisance Abatement Acts,2007,[ebook] ‘I’ve hated jacks since I got bashed after a demo’,jack
None,"[{'@first': 'yes', 'date': '1919', 'tit': 'Aussie', 'num': '14/1', '#text': '(France) XII Mar. [of a military policeman] J’s for the Jacks — keep out of their way / If you don’t like C.B. and a thirsty pay-day'}, {'date': '1924', 'con': 'WWI', 'aut': 'A.G. Pretty', 'tit': 'Gloss. of Sl. [...] in the A.I.F. 1921–1924', 'num': 'n.p.', 'scaps': 'jacks', '#text': '(rev. t/s) . Military Police'}, {'date': '1925', 'con': 'WWI', 'aut': 'Fraser & Gibbons', 'tit': 'Soldier and Sailor Words', 'num': '130', 'i': 'Jacks', '#text': ', The: Military Police'}, {'date': '1930', 'con': '1914–18', 'aut': 'Brophy & Partridge', 'tit': 'Songs and Sl. of the British Soldier', 'num': '131', 'scaps': 'Jacks', '#text': '. — Military Police'}, {'@class': 'new', 'date': '1943', 'tit': 'Sydney Morn. Herald', 'num': '7/3', '#text': '11 Dec. The Australian military police [...] invariably known as ‘jacks’'}]","constr. with , the Military Police",noun,jack,1919,(France) XII Mar. [of a military policeman] J’s for the Jacks — keep out of their way / If you don’t like C.B. and a thirsty pay-day,1943,11 Dec. The Australian military police [...] invariably known as ‘jacks’,jack
late 19C+,"[{'@class': 'new', '@first': 'yes', 'date': '1945', 'tit': 'Mess Songs & Rhymes of the RAAF', 'num': '29', '#text': '‘Beaufort’ in With all sorts of horrible pains in our jacks'}, {'date': '1981', 'aut': 'S. Berkoff', 'tit': ['Decadence', 'Decadence and Other Plays'], 'edn': '1985', 'num': '30', '#text': 'in Shove that up your jack'}, {'date': '1984', 'aut': 'Partridge', 'tit': 'DSUE', 'edn': '8th edn', 'num': '607', '#text': 'C.19–20'}, {'date': '1994', 'aut': 'B. Fallowell', 'tit': 'One Hot Summer in St Petersburg', 'num': '148', '#text': 'He looks alarmed, as though expecting a swagger stick up his jack any second'}]",the anus,noun,jack,1945,‘Beaufort’ in With all sorts of horrible pains in our jacks,1994,"He looks alarmed, as though expecting a swagger stick up his jack any second",jack
