chrlbl,citations,definition,part_of_speech,word,first_citation_date,first_citation_text,last_citation_date,last_citation_text,family
1970s+,"[{'@first': 'yes', 'date': '1970', 'aut': 'G. Scott-Heron', 'tit': 'Vulture', 'edn': '1996', 'num': '56', '#text': 'I sat [...] and drank a Jack D'}, {'date': '1972', 'aut': 'L. Bangs', 'tit': 'Psychotic Reactions', 'edn': '1988', 'num': '108', '#text': 'Reaching the halfway point in my fifth of Jack’s'}, {'date': '1992', 'aut': 'J. Mowry', 'tit': 'Way Past Cool', 'num': '140', '#text': 'Gots me a whole motherfuckin quart of Jack D'}, {'date': '1993', 'aut': 'T. Jones', 'tit': 'Pugilist at Rest', 'num': '59', '#text': 'Bagitt [...] threw up, which was a shame considering he had finished off at least a third of a bottle of Jack'}, {'date': '1998', 'con': '1986', 'aut': 'G. Pelecanos', 'tit': 'Sweet Forever', 'num': '58', '#text': 'The table was crowded with [...] a couple of dirty ashtrays and three shot glasses holding the smell of Jack Black'}, {'date': '2000', 'aut': 'N. Barlay', 'tit': 'Crumple Zone', 'num': '173', '#text': 'Shot of Jack in his hand and still sniffing from his last trip to the toilet'}, {'date': '2001', 'con': '1975–6', 'aut': 'E. Little', 'tit': 'Steel Toes', 'num': '129', '#text': 'Tell her to bring [...] a double shot of Jack D on the rocks for me'}, {'date': '2002', 'aut': 'D.H. Sterry', 'tit': 'Chicken', 'edn': '2003', 'num': '130', '#text': 'Let me get you some Jack and a Jill'}, {'@class': 'new', 'date': '2002', 'aut': 'R.G. Barrett', 'tit': 'Mystery Bay Blues', 'num': '91', '#text': 'Would you like a drink [...] There’s Jackies and ice in the kitchen'}, {'@class': 'us', 'date': '2006', 'aut': 'P.M. Levesque', 'tit': 'Confessions of a Dylanomaniac', 'num': '458', '#text': '[We] put back enough Jack’s to get a glow on'}, {'date': '2006', 'aut': 'G. Pelecanos', 'tit': 'Night Gardener', 'num': '230', '#text': 'Good ole Jackie D, baby'}, {'date': '2008', 'aut': 'T. Piccirilli', 'tit': 'Fever Kill', 'num': '105', '#text': 'She [...] steals two bottles of Jack'}, {'@class': 'new', 'date': '2008', 'aut': 'J. Niven', 'tit': 'Kill Your Friends', 'edn': '2009', 'num': '51', '#text': '‘Any more for any more?’ [...] ‘Wifebeater,’ say I. ‘Rockschool,’ say the other two. Trellick gets the Stella and the Jack and Cokes in'}, {'@class': 'new', 'date': '2010', 'aut': 'K. Richards', 'tit': 'Life', 'num': '495', '#text': 'Wine had [...] given way to Jack Daniel’s as the favored band beverage [...] the Jack flowed again and other stuff too'}]",Daniel’s brand of whisky,noun,Jack,1970,I sat [...] and drank a Jack D,2010,Wine had [...] given way to Jack Daniel’s as the favored band beverage [...] the Jack flowed again and other stuff too,jack
18C,"{'@first': 'yes', 'date': '1708', 'aut': 'Ebsworth', 'tit': 'Bagford Ballads', 'edn': '1878', 'num': '386', '#text': 'ballad title in  I Jack French-man’s Defeat'}",denoting a nationality; eg,prefix,Jack-,1708,ballad title in  I Jack French-man’s Defeat,1708,ballad title in  I Jack French-man’s Defeat,jack
14C–17C; 20C+,"[{'@first': 'yes', 'circa': '1525', 'aut': 'J. Rastell', 'tit': 'Gentleness and Nobility', 'num': '239', '#text': 'line Nay, iwys, pyvsh and rude Jack Javell'}, {'date': '1577', 'tit': 'Misogonus', 'aut': 'Farmer', 'edn': '1906', 'num': 'II i', '#text': 'in Marry. sir! this Jack Prat will go boast'}, {'date': '1593', 'aut': 'Shakespeare', 'tit': 'Taming of the Shrew', 'num': 'II i', '#text': 'To wish me wed to one half lunatic; A madcap ruffian and a swearing Jack'}, {'date': '1607', 'aut': 'Dekker & Webster', 'tit': 'Westward Hoe', 'num': 'IV i', '#text': 'There be a thousand bragging Jackes in London'}, {'date': '1617', 'aut': 'J. Taylor', 'tit': 'Works', 'edn': '1869', 'num': '120', 'i': ['Iacke-a-Lent', 'Iacke'], '#text': '‘Iacke a Lent’ in  I If any poore  doe happen into the hands of a foole, tis but a Foole and a , or two fooles well met'}, {'date': '1640', 'aut': 'H. Mill', 'tit': 'Nights Search', 'num': '52', '#text': 'I For I do use her, as a hooke and line To catch Iack-simple'}, {'date': '1641–74', 'aut': 'Ebsworth', 'tit': 'Roxburghe Ballads', 'edn': '1891', 'num': '341', '#text': '‘The Merry Country Maid’s Answer’ in  VII:2 For rather than I’le marry such a Clownish Jack, / I’le buy a witty fellow cloath[e]s to put on ’s back'}, {'date': '1659', 'tit': 'Catterpillers of this Nation Anatomized', 'num': '5', '#text': 'Its likely they are but lately rose from that doglike life of Iackyes like the fool that is proud of his own wit'}, {'date': '1675', 'aut': 'C. Cotton', 'tit': 'Scoffer Scoff’d', 'edn': '1765', 'num': '221', 'i': ['Jack', 'Mountebanking Quack'], '#text': 'This , / This paltry'}, {'date': '1948', 'aut': 'P. Kavanagh', 'tit': 'Tarry Flynn', 'edn': '1965', 'num': '97', '#text': '‘Shut up, you jack, you,’ said Mary'}, {'date': '1989', 'aut': 'H. Rawson', 'tit': 'Dict. of Invective', 'edn': '1991', 'num': '14', 'i': 'Chico, Charlie, Heinie, Hymie, Jack, Mick, Paddy', '#text': 'The insulting connotations usually come through most clearly when the familiar form of a name is used, as in'}, {'date': '2000', 'tit': 'Indep.', 'num': '10', '#text': 'Rev. 3 Mar. A jack named Vig [...] a dopey redneck who wouldn’t know responsibility if it palled up with him in a bar'}]",a fool,noun,jack,1525,"line Nay, iwys, pyvsh and rude Jack Javell",2000,Rev. 3 Mar. A jack named Vig [...] a dopey redneck who wouldn’t know responsibility if it palled up with him in a bar,jack
1900s,"{'@class': 'new us', '@first': 'yes', 'date': '1908', 'tit': 'Dly Press', 'num': '12/14', '#text': '(Newport News, VA) 19 Apr. Once in a whilea pickpkcket will run across a drunken man who is easy to rob. Such a man is known as a ‘jack’'}",a drunk individual who is made the victim of a theft,noun,jack,1908,"(Newport News, VA) 19 Apr. Once in a whilea pickpkcket will run across a drunken man who is easy to rob. Such a man is known as a ‘jack’",1908,"(Newport News, VA) 19 Apr. Once in a whilea pickpkcket will run across a drunken man who is easy to rob. Such a man is known as a ‘jack’",jack
17C; 19C+,"[{'@first': 'yes', 'date': '1604', 'aut': 'Dekker', 'tit': 'Honest Whore', 'num': 'I i', '#text': 'Pt 1 [He] taught her to play upon the Virginals, and still his Jacks leapt up'}, {'date': '1834', 'tit': 'Flash Chaunter', 'num': '44', '#text': '‘Parody on Love’s Ritornella’ Your Jack you have slip’d / (Of time) in the nick'}, {'@class': 'new', 'date': '1840', 'tit': ['Facetious Songster', 'Bawdy Songbooks'], 'src': 'Spedding & Watt', 'edn': '2011', 'num': '271', '#text': '‘The Female Gamester’ in in (eds) III Whene’er she deals she cribs or steals, / And can always lug out Jack'}, {'@class': 'new19C', 'date': '1875', 'aut': 'E. Sellon', 'tit': 'New Epicurean', 'num': '21', '#text': 'Away flew too material buttons, and Jack sprang out of his box into her hand'}, {'@class': 'new uk', 'date': '1882', 'tit': 'Cremorne', 'num': '28', '#text': 'I This fresh bit of fish made Jacko rise again'}, {'@class': 'N331', 'date': '1890–1904', 'aut': 'Farmer & Henley', 'tit': 'Sl. and Its Analogues'}, {'@class': 'new19C', 'date': '1898', 'aut': '‘Mary Suckit’', 'tit': 'Yvonne', 'num': '24', '#text': 'Employing terms like «prick, Jack, rammer», the gentleman [...] took out his bursting cock'}, {'date': '1927', 'tit': 'Immortalia', 'num': '9', '#text': 'Pete war thar with every tack, / And kept a-lettin’ out more jack'}, {'date': '1945', 'aut': 'Randolph & Legman', 'tit': 'Ozark Folksongs and Folklore', 'edn': '1992', 'num': '670', '#text': 'in  II  [as cit. 1927]'}]",the penis,noun,jack,1604,"Pt 1 [He] taught her to play upon the Virginals, and still his Jacks leapt up",1945,in  II  [as cit. 1927],jack
late 19C+,"[{'@first': 'yes', 'date': '1890–1904', 'aut': 'Farmer & Henley', 'tit': 'Sl. and Its Analogues'}, {'date': '1959', 'i': 'on jack', '#text': 'personal recollection:'}, {'date': '1963', 'aut': 'A. Baron', 'tit': 'Lowlife', 'edn': '2001', 'num': '26', '#text': 'From too much staying in bed I got the jack up to my eyebrows'}, {'date': '1988', 'con': '1940s', 'aut': 'C. Bram', 'tit': 'Hold Tight', 'edn': '1990', 'num': '185', '#text': 'I [...] ’jaculate my jack / Into some seafood mama'}, {'date': '1989', 'aut': 'J. Morton', 'tit': 'Lowspeak', 'num': '78', '#text': 'Jack – erection, as in ‘I had a jack up to my eyebrows’'}]","an erection; thus  adj., erect; thus often as sexual desire",noun,jack,1890,,1989,"Jack – erection, as in ‘I had a jack up to my eyebrows’",jack
1950s+,"{'@first': 'yes', 'date': '1984', 'aut': 'Partridge', 'tit': 'DSUE', 'edn': '8th edn', 'num': '607', '#text': 'since ca. 1950'}",copulation,noun,jack,1984,since ca. 1950,1984,since ca. 1950,jack
1980s+,"[{'@first': 'yes', 'date': '1984', 'aut': 'C. White', 'tit': 'Life and Times of Little Richard', 'num': '128', '#text': 'I haven’t had my morning jack yet!'}, {'@class': 'new', 'date': '2008', 'aut': 'Simon & Burns', 'tit': 'Generation Kill', '#text': '‘Bomb in the Garden’  ep. 7 [TV script] Takes me to this porn shop, so he can have a jack in the booths'}]",an act of masturbation,noun,jack,1984,I haven’t had my morning jack yet!,2008,"‘Bomb in the Garden’  ep. 7 [TV script] Takes me to this porn shop, so he can have a jack in the booths",jack
1990s+,"{'@first': 'yes', 'date': '1995', 'aut': 'L. Stavsky', 'tit': 'A2Z', '#text': 'et al.'}",a gun,noun,jack,1995,et al.,1995,et al.,jack
late 17C–mid-19C,"[{'@first': 'yes', 'circa': '1685', 'aut': 'Ebsworth', 'tit': 'Bagford Ballads', 'edn': '1878', 'num': '436', '#text': '‘The Destruction of Plain Dealing’ in  I But faith now their calling is not worth a jack'}, {'circa': '1698', 'aut': 'B.E.', 'tit': 'Dict. Canting Crew'}, {'@class': 'N331', 'date': '1703', 'tit': 'Hell Upon Earth', 'num': '5', 'i': 'Jack', '#text': ', a Farthing'}, {'date': '1709', 'aut': 'N. Ward', 'tit': 'Compleat and Humorous Account of Remarkable Clubs', 'edn': '1756', 'num': '234', 'i': 'Easter', '#text': 'He could [...] have pick’d up a Hog with more Ease than he now could eight Jacks upon an  Holiday'}, {'date': '1719', 'aut': 'A. Smith', 'tit': 'Lives of Most Notorious Highway-men, etc.', 'edn': '1926', 'num': '207', 'i': ['Jack', 'He would not tip me a jack'], '#text': ', a farthing. , i.e., he would not give me a farthing'}, {'date': '1725', 'tit': 'New Canting Dict.', 'num': 'n.p.', 'scaps': 'jack', 'i': 'He wou’d not tip me a Jack', '#text': 'a Farthing; , Not a Farthing wou’d he give me'}, {'date': ['1737', '1759', '1760', '1776'], 'aut': 'Bailey', 'tit': 'Universal Etym. Eng. Dict.', '#text': '[as cit. 1725]'}, {'date': '1741', 'tit': 'Canting Academy, or the Pedlar’s-French Dict.', 'num': '113', 'i': 'A Jack', '#text': 'A Farthing'}, {'date': '1753', 'aut': 'J. Poulter', 'tit': 'Discoveries', 'edn': '1774', 'num': '43', 'i': 'a Halfpenny and Farthing', '#text': 'A Meag and Jack;'}, {'date': ['1785', '1788', '1796'], 'aut': 'Grose', 'tit': 'Classical Dict. of the Vulgar Tongue'}, {'ante': '1790', 'aut': 'H.T. Potter', 'tit': 'New Dict. Cant', 'edn': '1795'}, {'date': '1809', 'aut': 'G. Andrewes', 'tit': 'Dict. Sl. and Cant'}, {'date': '1811', 'tit': 'Lex. Balatronicum'}, {'date': '1823', 'aut': 'Egan', 'tit': 'Grose’s Classical Dict. of the Vulgar Tongue'}, {'date': '1835', 'aut': 'G. Kent', 'tit': 'Modern Flash Dict.'}, {'date': '1848', 'tit': ['Flash Dict.', 'Sinks of London Laid Open'], '#text': 'in'}, {'date': '1859', 'aut': 'Matsell', 'tit': 'Vocabulum', 'num': '44', 'scaps': 'jack', '#text': 'A small coin'}]",a farthing,noun,jack,1685,‘The Destruction of Plain Dealing’ in  I But faith now their calling is not worth a jack,1859,A small coin,jack
19C+,"[{'@first': 'yes', 'date': '1807', 'xr': {'xsub': 'make one’s jack', 'i': 'under', 'xhw': 'jack', 'xpos': 'n.', 'xhom': '4'}, '#text': 'implied in'}, {'@class': 'us', 'date': '1890', 'aut': 'M. Townsend', 'tit': 'Index USA', 'num': '427', 'scaps': 'Have you any', '#text': 'The [...] verbal wealth of the United States language is illustrated in an inquiry for a loan of money; by using any of the following words in conjunction with the inquiry,  [...] Jacks, [etc.]'}, {'@class': 'N331', 'date': '1916', 'tit': ['Waukesha', 'Freeman'], 'num': '3/3', '#text': '(Wisc.)  14 Sept. The slang expression ‘jack’ for potable funds has ben going the rounds of the country'}, {'date': '1918', 'aut': 'R. Lardner', 'tit': 'Treat ’Em Rough', 'num': '69', '#text': 'Each one of the boys gets $3600.00 and that would of been my share only I loved my country more than a few dollars and I bet the boys feel kind of ashamed of themself to think I was the only one that passed up all that jack to work for Uncle Sam'}, {'date': '1922', 'aut': 'M.E. Smith', 'tit': 'Adventures of a Boomer Op.', 'num': '19', '#text': 'I sure would like a piece of ‘Jack’, because if money talks, there is no scandal going on in my pocket'}, {'@class': 'N331', 'date': '1922', 'aut': 'S. Lewis', 'tit': 'Babbitt', 'edn': '1974', 'num': '128', '#text': 'A fellow that merely goes out for the jack'}, {'@class': 'N331', 'date': '1926', 'aut': 'J. Tully', 'tit': 'Jarnegan', 'edn': '1928', 'num': '238', '#text': 'I’m in the big jack'}, {'@class': 'N331', 'date': '1929', 'aut': 'W.R. Burnett', 'tit': 'Little Caesar', 'edn': '1932', 'num': '11', '#text': 'The place is lousy with jack'}, {'@class': 'N331', 'date': '1930', 'con': '1900s–10s', 'aut': 'Dos Passos', 'tit': ['42nd Parallel', 'USA'], 'edn': '1966', 'num': '144', '#text': 'in I thought I better come up here and see the folks before I spent all my jack'}, {'@class': 'N331', 'date': '1931', 'aut': 'Sterling Brown', 'src': 'Botkin', 'tit': 'Folk-Say', 'num': '121', '#text': '‘New St. Louis Blues III’ in Kin bum tobacco but I cain’t bum de jack fo’ bail'}, {'date': '1939', 'aut': 'J. Weidman', 'tit': 'What’s In It For Me?', 'num': '340', '#text': 'You’ve borrowed close to 30,000 bucks so far... that’s a lot of jack'}, {'@class': 'N331', 'date': '1940', 'aut': 'D. Maurer', 'tit': 'Big Con', 'num': '131', '#text': 'That was all the jack he could get his mitts on'}, {'date': '1946', 'aut': 'S. Jackson', 'tit': 'Indiscreet Guide to Soho', 'num': '104', '#text': 'It is no uncommon thing to see them drop watches [...] and cuff-links in the ‘kitty’ when they run out of ‘jack’'}, {'date': '1953', 'aut': 'J. Thompson', 'tit': 'Savage Night', 'edn': '1991', 'num': '7', '#text': 'All the jack he’d made in the rackets was gone'}, {'date': '1961', 'aut': 'T.I. Rubin', 'tit': 'In the Life', 'num': '97', '#text': 'Got to get the jack together. Want to go in style'}, {'@class': 'N331', 'date': '1964', 'aut': 'B. Jackson', 'tit': 'Get Your Ass in the Water', 'edn': '1974', 'num': '101', '#text': 'I had just got back with a load of jack / from out where the big shot reside'}, {'@class': 'N331', 'date': '1968', 'aut': 'G. Cuomo', 'tit': 'Among Thieves', 'num': '90', '#text': 'I got a little jack'}, {'date': '1974', 'aut': 'G.F. Newman', 'tit': 'You Flash Bastard', 'num': '63', '#text': 'He indicated the forged bank-notes [...] Sneed produced a genuine five-pound note to compare them [...] He offered them to Feast [...] He took his Jack back from the DS'}, {'date': '1978', 'con': 'WWII', 'aut': 'T. Sanchez', 'tit': 'Hollywoodland', 'edn': '1981', 'num': '107', '#text': 'You got more jack than FDR'}, {'date': '1987', 'aut': '‘Joe Bob Briggs’', 'tit': 'Joe Bob Goes to the Drive-In', 'num': '5', '#text': 'A bunch of sleazy guys [...] trying to hustle up enough jack so they can move to Atlantic City'}, {'date': '1997', 'con': '1970s', 'aut': 'G. Pelecanos', 'tit': 'King Suckerman', 'edn': '1998', 'num': '192', '#text': 'Hook up with Trouble Man, get the rest of our jack'}, {'date': '2001', 'con': '1929', 'aut': 'N. Tosches', 'tit': 'Where Dead Voices Gather', 'num': '137', '#text': '(ms.) Brown talks of blindsiding his woman, of [...] ‘spendin’ her jack’'}, {'@class': 'new', 'date': '2003', 'aut': 'Simon & Pelecanos', 'tit': 'Wire', '#text': '‘Duck and Cover’ ser. 2 ep. 8 [TV script] You gonna get a car you gonna need some jack'}]",money,noun,jack,1807,implied in,2003,‘Duck and Cover’ ser. 2 ep. 8 [TV script] You gonna get a car you gonna need some jack,jack
mid-19C,"[{'@first': 'yes', 'date': '1859', 'aut': 'Hotten', 'tit': 'Dict. of Modern Sl. etc.', 'num': '52', 'scaps': 'jacks', '#text': 'Jacks and Half Jacks card counters, resembling in size and appearance sovereigns and half sovereigns, for which they are occasionally passed to simple persons. In large gambling establishments the ‘heaps of gold’ are frequently composed mainly of'}, {'@class': 'N331', 'date': '1860', 'aut': 'Hotten', 'tit': 'Dict. of Modern Sl. etc.'}, {'date': '1861', 'con': '1840s–50s', 'aut': 'H. Mayhew', 'tit': 'London Labour and London Poor', 'num': '349/2', '#text': 'I The ‘card-counters,’ or, [...] the ‘small coins,’ are now of a very limited sale. The slang name for these articles is ‘Jacks’ and ‘Half Jacks’'}, {'@class': 'N331', 'date': '1870', 'aut': 'Hotten', 'tit': 'Sl. Dict.'}, {'date': '1873', 'tit': 'Sl. Dict.'}]","a counter, similar in size and shape to a sovereign or half-sovereign, used in gambling houses and casinos",noun,jack,1859,"Jacks and Half Jacks card counters, resembling in size and appearance sovereigns and half sovereigns, for which they are occasionally passed to simple persons. In large gambling establishments the ‘heaps of gold’ are frequently composed mainly of",1873,,jack
1920s,"{'@class': 'new us', 'date': '1928', 'aut': 'Yodelling Kid Brown', '#text': '‘Policy Blues [lyrics] It takes five numbers to make a jack, / And you must be born lucky to get your money back'}",a combination of five digits used in,noun,jack,1928,"‘Policy Blues [lyrics] It takes five numbers to make a jack, / And you must be born lucky to get your money back",1928,"‘Policy Blues [lyrics] It takes five numbers to make a jack, / And you must be born lucky to get your money back",jack
20C+,"[{'@first': 'yes', 'date': '1948', 'aut': 'R. Raven-Hart', 'tit': 'Canoe in Aus.', 'num': '187', '#text': 'Pennies supplied by ‘school’ to avoid ‘nobs’, ‘jacks’, double-sided heads, ‘greys’, double-sided tails'}, {'date': '1967', 'tit': 'Kings Cross Whisper', 'num': '6/3', 'scaps': 'jack', '#text': '‘Whisper All Aussie Dict.’ in  (Sydney) xxxv : A double-headed penny'}, {'date': '1983', 'aut': 'R. Aven-Bray', 'tit': 'Ridgey-Didge Oz Jack Lang', 'num': '32', 'b': 'Jack', '#text': 'Double-headed penny'}, {'date': '1999', 'aut': 'G. Seal', 'tit': 'Lingo', 'num': '150', 'scaps': ['kips', 'lannets', 'nob, jack', 'gray'], '#text': 'Early  (also called ) are said to have been masterpieces of carpentry often with secret compartments used to hide double-headed () or double-tailed () pennies'}]","in two-up, a double-headed coin",noun,jack,1948,"Pennies supplied by ‘school’ to avoid ‘nobs’, ‘jacks’, double-sided heads, ‘greys’, double-sided tails",1999,Early  (also called ) are said to have been masterpieces of carpentry often with secret compartments used to hide double-headed () or double-tailed () pennies,jack
