chrlbl,citations,definition,part_of_speech,word,first_citation_date,first_citation_text,last_citation_date,last_citation_text,family
None,"[{'@first': 'yes', 'date': '1977', 'aut': 'A. Bleasdale', 'tit': 'Who’s Been Sleeping in my Bed', 'num': '162', '#text': '‘Lookin’?’ he said. ‘Fuck that f’a lark. I’m gonna blast it out of the sky.’'}, {'date': '1979', 'aut': 'J. Morrow', 'tit': 'Confessions of Proinsias O’Toole', 'num': '108', '#text': 'Hiya, Francie oul’ son! Fuck this for a geg'}, {'date': '1984', 'aut': 'Partridge', 'tit': 'DSUE', 'edn': '8th edn', 'num': '432/2', '#text': 'C.19–20'}, {'date': '1989', 'aut': 'H. Leonard', 'tit': 'Out After Dark', 'num': '3', '#text': 'Cloggy said: ‘Shag that for a lark.’'}, {'date': '1997', 'aut': 'C. McPherson', 'tit': 'The Weir', 'num': '50', '#text': 'And I was all like ‘fuck this’ you know?'}, {'date': '2000', 'con': '1943', 'tit': 'www.arnhemarchive.org', '#text': 'L/Cpl J.J. Bird at  [Internet] One of the Commandos in the craft asked Jack Bird ‘What mob do you blokes belong to?’, he replied ‘We’re airborne troops’, to which the man said ‘Fuck that for a lark.’ and pulled out his flask and offered Jack a drink'}, {'date': '2001', 'aut': 'K. Sampson', 'tit': 'Outlaws', 'edn': 'ms.', 'num': '136', '#text': 'Ah, fuck this for a lark, I think. I can’t listen to this shite'}, {'date': '2006', 'tit': ['Skinhead Hamlet', 'sub-zero.mit.edu'], 'scaps': 'fortinbras', '#text': 'at  [Internet] : Fuck this for a lark then. Let’s piss off. [Exeunt with alarums]'}]","an excl. of derision, indicating something is not working or that one is giving up",phrase,fuck that/this for a lark!,1977,‘Lookin’?’ he said. ‘Fuck that f’a lark. I’m gonna blast it out of the sky.’,2006,at  [Internet] : Fuck this for a lark then. Let’s piss off. [Exeunt with alarums],fuck
,"[{'@first': 'yes', 'date': '1984', 'aut': 'Partridge', 'tit': 'DSUE', 'edn': '8th edn', 'num': '432/2', '#text': 'C.19–20'}, {'date': '1988', 'aut': 'J. Healy', 'tit': 'Grass Arena', 'edn': '1990', 'num': '123', '#text': 'She started getting more sexy. Fuck this lark. Struggling to get out from under her, I saw Hogan [...] grinning, enjoying my discomfort'}]",don’t expect me to get mixed up in that! that’s a stupid idea!,phrase,fuck that/this for a lark!,1984,C.19–20,1988,"She started getting more sexy. Fuck this lark. Struggling to get out from under her, I saw Hogan [...] grinning, enjoying my discomfort",fuck
1940s+,"[{'@first': 'yes', 'date': '1977', 'aut': 'S. Berkoff', 'tit': ['East', 'Decadence and Other Plays'], 'edn': '1985', 'num': '48', '#text': 'in I thought now fuck this for a laugh'}, {'date': '1993', 'aut': 'I. Welsh', 'tit': 'Trainspotting', 'num': '36', '#text': 'Fuck all that for a laugh. Tonight she’d take her chances at the gig'}, {'date': '2004', 'aut': 'King & Love', 'tit': 'Football Factory', '#text': '[film script] Then go and spunk your wages on kebabs, fruit machines and brasses? Fuck that for a laugh!'}]","an excl. of derision, indicating something is not satisfactory or rejecting an idea that is unfeasible",phrase,fuck that/this for a laugh!,1977,in I thought now fuck this for a laugh,2004,"[film script] Then go and spunk your wages on kebabs, fruit machines and brasses? Fuck that for a laugh!",fuck
1970s+,"[{'@class': 'new ire', '@first': 'yes', 'date': '1970', 'aut': 'A. Martin', 'tit': 'Winter’s Tales from Ireland', 'num': '122', '#text': '(ed.) I Be a blood. Come alive. Break out. Face them. Show them. Fuck the begrudgers. Die, if die you must, on your feet and fighting'}, {'@class': 'new ire', 'date': '1972', 'aut': 'P. Hutchinson', 'tit': 'Watching the Morning Grow', 'num': '32', '#text': 'Rackrent came round, we left a note: ‘Fuck the begrudgers’'}, {'@class': 'ire N331', '@first': 'yes', 'date': '1987', 'aut': 'V. Caprani', 'tit': 'Vulgar Verse and Variations', 'num': 'n.p.', 'org': 'BS', '#text': '‘Same again Jem?’ ‘Sound man Vinno. And fuck the begrudgers!’'}, {'@class': 'ire', 'date': '1996', 'tit': 'Irish Times', '#text': '24 Sept. [Internet] ‘F**k the begrudgers!’ became the battle-cry of those determined on celebrating success at all costs'}, {'@class': 'new ire', 'date': '2013', 'aut': 'H. Browne', 'tit': 'Frontman', 'num': '3', '#text': ""‘Fuck the begrudgers’ is Ireland's ancient and venerable and ubiquitous version of 'haters gonna hate'.""}]",a general excl. of defiance or scorn,phrase,fuck the begrudgers!,1970,"(ed.) I Be a blood. Come alive. Break out. Face them. Show them. Fuck the begrudgers. Die, if die you must, on your feet and fighting",2013,‘Fuck the begrudgers’ is Ireland's ancient and venerable and ubiquitous version of 'haters gonna hate'.,fuck
1910s+,"[{'pre': '1917', 'tit': 'Tennessee Folk. Society Bulletin', 'edn': '1955', 'num': '100', 'org': 'HDAS', '#text': 'XXI Cuss ’em all, cuss ’em all, / Cuss ’em all but six! ]'}, {'@first': 'yes', 'date': '1953', 'aut': 'L. Uris', 'tit': 'Battle Cry', 'edn': '1964', 'num': '310', '#text': '‘Fugg you guys and save six for pallbearers,’ Levin shouted'}, {'date': '1981', 'aut': 'J. Ellroy', 'tit': 'Brown’s Requiem', 'num': '189', '#text': 'I say fuck ’em all and save six for the pallbearers'}, {'date': '2002', 'aut': 'P. Ford', 'tit': 'Ftrain.com', '#text': '‘4 Days, 4 Police Officers’ at  25 July [Internet] I’d say fuck them all but six, and save those for Paulbearers [sic], but in the interest of consistency, fuck the six, too, and cremate me instead'}, {'date': '2004', 'tit': 'www.jackjohnsonmusic.com', '#text': 'posting at  8 Apr. [Internet] Fuck them all but six. We’ll use them as pall bearers'}]",a general oath of annoyance and hostility; often ext. with,phrase,fuck them all but six/eight!,1917,"XXI Cuss ’em all, cuss ’em all, / Cuss ’em all but six! ]",2004,posting at  8 Apr. [Internet] Fuck them all but six. We’ll use them as pall bearers,fuck
1950s+,"[{'@first': 'yes', 'date': '1958', 'aut': 'R. Chandler', 'tit': 'Playback', 'num': '208', '#text': 'Why don’t you go kiss a duck?'}, {'date': '1958', 'aut': 'W. Talsman', 'tit': 'Gaudy Image', 'edn': '1966', 'num': '229', '#text': '‘Go fuck a fishnet,’ Minnie cooed. ‘There’s enough holes there for an army.’'}, {'date': '1961', 'con': 'early 1950s', 'aut': 'J. Peacock', 'tit': 'Valhalla', 'num': '235', '#text': '‘Oh go fuck a duck!’ Giff said angrily'}, {'date': '1988', 'aut': 'Eble', 'tit': 'Campus Sl.', 'num': '4', '#text': 'Oct. fuck a dog – exclamation of shock or displeasure: ‘I went out with another girl last night.’ ‘Oh, go fuck a dog!’'}]","an excl. of dismissal, or disbelief",phrase,go fuck a duck!,1958,Why don’t you go kiss a duck?,1988,"Oct. fuck a dog – exclamation of shock or displeasure: ‘I went out with another girl last night.’ ‘Oh, go fuck a dog!’",fuck
1930s+,"[{'@first': 'yes', 'date': '1964', 'aut': 'H. Selby Jr', 'tit': 'Last Exit to Brooklyn', 'edn': '1966', 'num': '7', '#text': 'Freddy [...] yelled at them to go fuck their mothers, ya cottonpickin bastards'}, {'date': '1972', 'aut': 'C. Bukowski', 'tit': 'Erections, Ejaculations etc.', 'num': '411', '#text': 'Arrr...go fuck your little sister...'}, {'date': '1974', 'aut': 'G.F. Newman', 'tit': 'You Flash Bastard', 'num': '130', '#text': 'Go fuck your dead mother. I can buy all you fuzz ten times over with loose change in my pocket'}, {'@class': 'new', 'date': '2008', 'aut': 'M. Hanif', 'tit': 'Case of Exploding Mangoes', 'edn': '2009', 'num': '16', '#text': 'I salute him, using all my silent drill practice to contain the inner cadence [...] ‘Fuck your mother too’'}]","an all-purpose dismissive excl., generally seen as a supremely offensive remark",phrase,go fuck your mother!,1964,"Freddy [...] yelled at them to go fuck their mothers, ya cottonpickin bastards",2008,"I salute him, using all my silent drill practice to contain the inner cadence [...] ‘Fuck your mother too’",fuck
late 19C+,"[{'@first': 'yes', 'date': '1894', 'tit': 'Report and Proceedings of the Senate Committee Appointed to Investigate the Police Dept of the City of N.Y.', 'num': '3158', '#text': 'cited in Q. Repeat what he said to you? A. He said, ‘Go on, fuck yourself, you son-of-a-bitch; I will give you a hundred dollars.’'}, {'date': '1920', 'tit': 'Committee of Fourteen Papers', 'num': '73', '#text': '‘Customer Cases’  21 June Go fuck yourself; it’s none of your damn business'}, {'date': '1922', 'aut': '‘J.H. Ross’', 'tit': 'Mint', 'edn': '1955', 'num': '85', '#text': '‘You’re all very happy,’ he sneered. ‘Go and fuck rattlesnakes,’ retorted Templer'}, {'date': '1927', 'aut': 'C. Sandburg', 'tit': 'Amer. Songbag', 'num': '183', '#text': '‘Shovellin’ Iron Ore’ in I, ‘Old man now what will you pay?’ Says he, ‘Two bits a ton.’ Says I, ‘Old man, go diddle yourself, I’d rather bum.’'}, {'date': '1929', 'aut': 'C. McKay', 'tit': 'Banjo', 'num': '115', '#text': 'Let the crackers go fiddle themselves, and you, too'}, {'circa': '1935', 'aut': 'B. Adelman', 'tit': 'Tijuana Bibles', 'edn': '1997', 'num': '28', '#text': '‘Betty Boop in “Flesh”’ [comic strip] in He didn’t do it for honor, / He didn’t do it for wealth; / He did it to accomodate an old pal / Who told him to ‘go fuck himself.’'}, {'@class': 'N331', 'date': '1936', 'aut': 'J.T. Farrell', 'tit': 'World I Never Made', 'num': '26', '#text': '‘Go fuck yourself!’ the kid with the beer snarled'}, {'@class': 'N331', 'date': '1937', 'aut': 'R. Westerby', 'tit': 'Wide Boys Never Work', 'edn': '1938', 'num': '198', '#text': 'If you don’t – well, you can go and --- yourself, that’s all'}, {'@class': 'N331', 'date': '1939', 'aut': 'R. Chandler', 'tit': 'Big Sleep', 'num': '97', '#text': '‘Go — yourself,’ the boy said softly'}, {'@class': 'N331', 'date': '1939', 'aut': 'H. Miller', 'tit': 'Tropic of Capricorn', 'edn': '1964', 'num': '174', 'i': ['go', 'fuck yourself'], '#text': 'He says  and hangs up the receiver'}, {'date': '1940s', 'aut': 'G. Logsdon', 'tit': 'Whorehouse Bells Were Ringing', 'edn': '1995', 'num': '107', '#text': '‘Wild Buckaroo’ in She screamed, ‘You jack rabbit! You shot off, you’re thru; / You can go fuck yourself now you Wild Buckaroo.’'}, {'date': '1948', 'aut': 'N. Mailer', 'tit': 'Naked and Dead', 'num': '10', '#text': 'Go fug yourself'}, {'date': '1950', 'aut': 'E. Hemingway', 'src': 'Baker', 'tit': 'Sel. Letters', 'edn': '1981', 'num': '698', '#text': 'letter 2 June in Posterity can take care of herself or fuck herself'}, {'date': '1951', 'aut': 'M. Spillane', 'tit': 'Long Wait', 'edn': '1954', 'num': '149', '#text': 'I felt like telling the guy to go shoot himself'}, {'date': '1956', 'aut': 'A. Ginsberg', 'tit': 'Howl & Other Poems', 'edn': '2000', 'num': '39', '#text': '‘America’ Go fuck yourself with your atom bomb'}, {'date': '1964', 'aut': 'A. Baraka', 'tit': ['Slave', 'Three Negro Plays'], 'edn': '1969', 'num': 'Act I', '#text': 'in  Go and fuck yourself'}, {'date': '1967', 'aut': 'J. Hibberd', 'tit': 'White with Wire Wheels', 'edn': '1973', 'num': '227', 'scaps': ['rod', 'simon'], '#text': ': Don’t push me too far, Simon. : Go flog yourself!'}, {'@class': 'N331', 'date': '1968', 'aut': 'N. Heard', 'tit': 'Howard Street', 'num': '61', '#text': 'Go fuck yourself, you wine-head bastard'}, {'date': '1971', 'aut': 'B. Malamud', 'tit': 'Tenants', 'edn': '1972', 'num': '77', '#text': 'If you don’t want to read what I show you, fuck your bloody ass'}, {'date': '1973', 'con': 'mid-1960s', 'aut': 'J. Patrick', 'tit': 'Glasgow Gang Observed', 'num': '116', '#text': 'Awa’ an’ take a regimental fuck tae yirsel'}, {'@class': 'N331', 'date': '1974', 'aut': 'G.F. Newman', 'tit': 'You Flash Bastard', 'num': '131', '#text': '‘Take your clothes off please, Mr Godder, we need to search you thoroughly.’ ‘Go and fuck yourself!’ – was Godder’s response'}, {'date': '1977', 'tit': 'Maledicta', 'num': '12', 'i': ['go fuck yourself', 'go fuck a dead horse', 'go fuck yourself with a rubber weenie', 'go fuck yourself in the ass and give yourself some brains'], '#text': '1 (Summer) In America one of the most usual insulting invitations today is  [...] This rather lacks bounce, and is sometimes varied or enlarged to: , or , or'}, {'@class': 'N331', 'date': '1978', 'aut': 'J. Webb', 'tit': 'Fields of Fire', 'edn': '1980', 'num': '25', '#text': 'Fuck yourself, you old fart'}, {'date': '1978', 'aut': 'L. Kramer', 'tit': 'Faggots', 'num': '267', '#text': '‘Go fuck yourself.’ ‘Go fuck yourself yourself.’'}, {'date': '1982', 'aut': 'G.V. Higgins', 'tit': 'Patriot Game', 'edn': '1985', 'num': '185', '#text': 'He will never [...] tell the client’s chief executive officer to go fuck himself'}, {'@class': 'N331', 'date': '1983', 'aut': 'C. Knight', 'tit': 'We Shall Not Die', 'num': '210', '#text': 'Go fuck yourself,’ Mambi replied'}, {'date': '1988', 'aut': 'R. Doyle', 'tit': 'Commitments', 'num': '47', '#text': 'Fuck yourself, you'}, {'@class': 'N331', 'date': '1989', 'aut': 'S. Armitage', 'tit': 'Zoom', 'num': '24', '#text': '‘Phenomenology’ in Harold Garfinkel can go fuck himself'}, {'@class': 'N331', 'date': '1989', 'aut': 'Pileggi & Scorsese', 'tit': 'Goodfellas', 'num': '61', '#text': '[film script] He just got shot in the foot by you and he tells you to go fuck yourself'}, {'date': '1993', 'con': '1945', 'aut': 'S. McAughtry', 'tit': 'Touch and Go', 'num': '101', '#text': 'Go jerk yourself, you stupid bastard'}, {'date': '1993', 'aut': 'T. Jones', 'tit': 'Pugilist at Rest', 'num': '83', '#text': '‘Well, fuck you,’ I said. ‘And fuck you, Go fuck yourself.’'}, {'@class': 'N331', 'date': '1998', 'aut': 'P. McCabe', 'tit': 'Breakfast on Pluto', 'num': '139', '#text': 'Oh, go and fuck yourself then!'}, {'@class': 'N331', 'date': '1999', 'tit': 'Guardian', 'num': '32', '#text': 'Weekend 18 Sept. His eyes said, ‘Go fuck yourself’'}, {'@class': 'N331', 'date': '2001', 'tit': 'Guardian', 'num': '7', '#text': 'Rev. 11 May Then guess what? Go fuck yourself'}, {'date': '2003', 'aut': 'P. Cornwell', 'tit': 'Blow Fly', 'edn': '2004', 'num': '127', '#text': 'Good riddance and go fuck yourself'}, {'@class': 'new', 'date': '2010', 'con': '1973', 'aut': 'C. Stella', 'tit': 'Johnny Porno', 'num': '97', '#text': 'We can use the recorder or you can go fuck yourself'}, {'@class': 'new', 'date': '2010', 'aut': 'L. Redhead', 'tit': 'Thrill City', '#text': '[ebook] Whoever the hell it was, I was gonna tell them to go fuck themselves'}, {'@class': 'new17C', 'date': '2017', 'aut': 'D. Winslow', 'tit': 'The Force', '#text': '[ebook] ‘Go fuck yourself.’ On Staten island it’s an expression of affection'}]",a general excl. of dismissal,phrase,go fuck yourself!,1894,"cited in Q. Repeat what he said to you? A. He said, ‘Go on, fuck yourself, you son-of-a-bitch; I will give you a hundred dollars.’",2017,[ebook] ‘Go fuck yourself.’ On Staten island it’s an expression of affection,fuck
None,"[{'@first': 'yes', 'date': '1952', 'aut': 'J. Jones', 'tit': 'From Here to Eternity', 'edn': '1998', 'num': '855', '#text': 'Get the f-- out of my way'}, {'date': '1975', 'aut': 'D. Goines', 'tit': 'Inner City Hoodlum', '#text': '175 ‘Get the fuck outta here!’ he screamed'}, {'date': '1989', 'con': '1950s–60s', 'aut': 'G. Tremlett', 'tit': 'Little Legs', 'num': '129', '#text': 'in You get the fuck. That means, fuck off'}, {'date': '1993', 'aut': 'Dr Dre', '#text': '‘Bitches Ain’t Shit’ [lyrics] Get’s the fuck out after you’re done'}, {'date': '1996', 'aut': 'Korn', 'tit': 'Life Is Peachy', '#text': '‘Good God’ [lyrics] on  [album] You stole my life without a sign / You sucked me dry. / Why dont you get the fuck out of my face, now?'}, {'date': '1999', 'aut': 'T. Dorsey', 'tit': 'Florida Roadkill', 'num': '90', '#text': 'Take Carlie Brown here and get the fuck out!'}, {'date': '2000', 'aut': 'W. Shaw', 'tit': 'Westsiders', 'num': '36', '#text': 'If you don’t go to school and work then get the fuck out'}]",an intensified var. on,phrase,get the fuck out!,1952,Get the f-- out of my way,2000,If you don’t go to school and work then get the fuck out,fuck
None,"[{'@first': 'yes', 'date': '1967', 'aut': 'P. Thomas', 'tit': 'Down These Mean Streets', 'edn': '1970', 'num': '20', '#text': '‘You cop out?’ ‘Yeah, I cop out.’ ‘You cop a plea?’ ‘Yeah, man, I cop a plea. Now will you get the fuck outta here?’'}, {'date': '1983', 'aut': 'C. Knight', 'tit': 'We Shall Not Die', 'num': '58', '#text': 'Run, Panca! Get di fuck out! Babylon!'}, {'date': '1993', 'aut': 'A. Rodriguez', 'tit': 'Spidertown', 'edn': '1994', 'num': '40', '#text': 'She laughed, striking his chest with a pointed foot. ‘Get the fuck.’'}, {'date': '2009', 'tit': 'Observer', 'num': '20', '#text': 'Mag. 4 Jan. Get the fuck out of here! that’s crazy'}]",an intensified var. on  and similar phr. of (joc.) disbelief,phrase,get the fuck out!,1967,"‘You cop out?’ ‘Yeah, I cop out.’ ‘You cop a plea?’ ‘Yeah, man, I cop a plea. Now will you get the fuck outta here?’",2009,Mag. 4 Jan. Get the fuck out of here! that’s crazy,fuck
1920s+,"[{'@first': 'yes', 'date': '1927', 'aut': '‘J.M. Hall’', 'tit': 'Anecdota Americana', 'num': '188', '#text': 'I All I sye is my bloody arse ’ole to you, you bloomin’ fuck'}, {'date': '1934', 'aut': 'H. Roth', 'tit': 'Call It Sleep', 'edn': '1977', 'num': '412', '#text': 'Yer an at’eist, yuh fuck, he hollers. A fuckin’ at’eist I says'}, {'date': '1948', 'con': '1944', 'aut': 'N. Mailer', 'tit': 'Naked and Dead', 'num': '500', '#text': 'You just gotta start sucking Mantelli, or that fat fuck first sergeant'}, {'date': '1956', 'aut': 'W. Burroughs', 'src': 'Harris', 'edn': '1993', 'num': '325', '#text': 'letter 16 Sept. in An English woman consults the old fuck'}, {'@class': 'N331', 'date': '1958', 'aut': 'Kerouac', 'src': 'Charters', 'edn': '1999', 'num': '116', '#text': 'letter Feb. in  II ‘Old dotin old fuck,’ I just said,, hearing a TV father whining to his daughter'}, {'@class': 'N331', 'date': '1959', 'aut': 'W. Burroughs', 'tit': 'Naked Lunch', 'edn': '1968', 'num': '59', '#text': 'He being such a horrible fuck'}, {'@class': 'N331', 'date': '1964', 'aut': 'H.S. Thompson', 'tit': 'Proud Highway', 'edn': '1997', 'num': '473', '#text': 'letter 25 Nov. in It is all these fucks who smile on the TV screen'}, {'@class': 'N331', 'date': '1964', 'aut': 'H. Selby Jr', 'tit': 'Last Exit to Brooklyn', 'edn': '1966', 'num': '4', '#text': 'His hair was mussed and he called him a fuck and whipped out his comb'}, {'date': '1968', 'aut': 'J. Hersey', 'tit': 'Algiers Motel Incident', 'num': '143', '#text': 'Them fucks took my tape recorder'}, {'@class': 'N331', 'date': '1969', 'aut': 'M. Puzo', 'tit': 'Godfather', 'num': '67', '#text': 'I’ll get that Johnny Fontane’s balls cut off, do you hear me, you guinea fuck?'}, {'@class': 'N331', 'date': '1970', 'aut': 'E. Thompson', 'tit': 'Garden of Sand', 'edn': '1981', 'num': '38', '#text': 'Forget them fucks who jumped out of Wall Street windows. They weren’t nothin'}, {'@class': 'N331', 'date': '1970', 'aut': 'G.V. Higgins', 'tit': 'Friends of Eddie Coyle', 'edn': '1973', 'num': '22', '#text': 'Arthur goes to jail. Dumb fuck'}, {'date': '1973', 'aut': 'P. Maas', 'tit': 'Serpico', 'num': '171', '#text': 'Now, you fuck, you’re going'}, {'@class': 'N331', 'date': '1974', 'con': '1960s', 'aut': 'R. Price', 'tit': 'Wanderers', 'num': '15', '#text': '‘Hey, you stupid fuck,’ Dougie hissed'}, {'date': '1974', 'aut': 'D. Goines', 'tit': 'Swamp Man', 'num': '106', '#text': 'Not like that sorry fuck Jamie and Willie had gone after'}, {'@class': 'N331', 'date': '1974', 'con': 'late 1940s', 'aut': 'E. Thompson', 'tit': 'Tattoo', 'edn': '1977', 'num': '637', '#text': 'Sometimes those dumb hillbilly fucks saw things and knew things others missed'}, {'@class': 'N331', 'date': '1981', 'aut': 'H. Gould', 'tit': 'Fort Apache, The Bronx', 'num': '178', '#text': 'I’ll bet that fat fuck’s heard something about the killings'}, {'@class': 'N331', 'date': '1981', 'aut': 'J. Ellroy', 'tit': 'Brown’s Requiem', 'num': '249', '#text': '[He was] calling me the ‘only good German in history’. ‘I’m an American, you stupid fuck,’ I retorted'}, {'@class': 'N331', 'date': '1987', 'con': '1920s', 'aut': 'L. Redmond', 'tit': 'Emerald Square', 'num': '190', '#text': 'My rebellious little heart rejoiced to hear some Liberties drunk give vent to his feelings. ‘Them crowd a’ fucks ... Them shower a’ whore’s bastards up in the mountains!’'}, {'date': '1987', 'aut': 'T. Wolfe', 'tit': 'Bonfire of the Vanities', 'num': '496', '#text': 'You don’t care who you hit, do you, you racist fuck!'}, {'@class': 'N331', 'date': '1990', 'con': 'early 1950s', 'aut': 'J. Ellroy', 'tit': 'L.A. Confidential', 'num': '27', '#text': 'He saw the fuck beat Mother dead with a tire iron'}, {'@class': 'N331', 'date': '1997', 'aut': 'C. Hiaasen', 'tit': 'Lucky You', 'num': '217', '#text': 'The snotty fuck'}, {'date': '1998', 'aut': 'D. Clowes', 'tit': 'Ghost World', 'num': '24', '#text': 'I’ve been going to business school ... I’m gonna be a big-ass corporate fuck'}, {'date': '1999', 'aut': 'N. Cohn', 'tit': 'Yes We have No', 'num': '275', '#text': 'I was a cheeky little fuck'}, {'@class': 'N331', 'date': '2000', 'aut': 'T. Udo', 'tit': 'Vatican Bloodbath', 'num': ['9', '30'], '#text': 'All those sick twisted rich fucks around him go ’bout humpin’ little kids. [Ibid.] He was, without doubt, the dumbest fuck ever to hold the office of Pope'}, {'@class': 'N331', 'date': '2002', 'aut': 'D. Flusfeder', 'tit': 'Gift', 'num': '137', '#text': 'I got to tell you something, you’re an elusive fuck you know that?'}, {'date': '2004', 'aut': 'J. Ellroy', 'tit': 'Destination: Morgue!', 'edn': '2004', 'num': '286', 'i': 'ex', '#text': '‘Hot-Prowl Rape-O’ in The fuck relandscaped eight backyards. The fuck fucking -caped'}, {'date': '2005', 'aut': 'L. Theroux', 'tit': 'Call of the Weird', 'edn': '2006', 'num': '130', '#text': 'She’d insulted Susan’s masseuse, who had a legbrace [...] calling him either a ‘fucking cripple’ or a ‘handicapped fuck’'}, {'@class': 'new', 'date': '2010', 'con': '1973', 'aut': 'C. Stella', 'tit': 'Johnny Porno', 'num': '45', '#text': 'Bring me the money you owe, you deadbeat fuck'}, {'@class': 'new', 'date': '2010', 'aut': 'L. Redhead', 'tit': 'Thrill City', '#text': '[ebook] My first reaction was boiling rage. Who did that fat fuck think he was?'}, {'@class': 'new', 'date': '2012', 'aut': 'J. Fagan', 'tit': 'Panopticon', 'edn': '2013', 'num': '126', '#text': 'Helen thinks it will help if I say hello tae the drooling old fuck'}, {'@class': 'new N331', 'date': '2013', 'aut': 'J. Stahl', 'tit': 'Bad Sex on Speed', 'num': '76', '#text': 'Walt Disney was a Jew-hating fascist fuck'}, {'@class': 'new19A', 'date': '2018', 'aut': 'C. Hammer', 'tit': 'Scrublands', '#text': '[ebook] ‘I think you are a profoundly sad and twisted old fuck’'}, {'@class': 'new19B', 'date': '2019', 'aut': 'N. Walker', 'tit': 'Cherry', 'num': '18', '#text': 'I was attending one of the local universities, the one with the Jesuits and a lot of kids who were fucks'}]","a person, esp. despicable and usu. with qualifying adj., e.g. ,",noun,fuck,1927,"I All I sye is my bloody arse ’ole to you, you bloomin’ fuck",2019,"I was attending one of the local universities, the one with the Jesuits and a lot of kids who were fucks",fuck
1940s+,"[{'@first': 'yes', 'date': '1946', 'xr': {'@href': '25102#1', 'xsub': 'fuck book', 'i': 'under', 'xhw': 'fuck', 'xpos': 'n.'}, '#text': 'implied in'}, {'date': '1967', 'aut': 'J. Rechy', 'tit': 'Numbers', 'edn': '1968', 'num': '105', '#text': 'I got some fuck-movies at home'}, {'date': '1974', 'aut': 'P. Gent', 'tit': 'North Dallas Forty', 'num': '146', '#text': 'It was one of the descriptive phrases used by Maxwell in the course of a fuck story'}, {'date': '1978', 'aut': 'P. Theroux', 'tit': 'Picture Palace', 'num': '139', '#text': 'Were these fuck shots merely a sleazy detonator for his libido?'}, {'date': '1981', 'aut': 'J. Ellroy', 'tit': 'Brown’s Requiem', 'num': '110', '#text': 'The blank cheques and the fuck pictures don’t mean nothing'}, {'date': '1986', 'aut': 'R. Campbell', 'tit': 'In La-La Land We Trust', 'edn': '1999', 'num': '6', '#text': '‘Motion pictures, music videos, instruction tapes, erotica ... ’‘Fuck flicks?’'}, {'date': '1988', 'aut': 'T. Harris', 'tit': 'Silence of the Lambs', 'edn': '1991', 'num': '278', '#text': 'There would have been trouble even if she hadn’t found the fuck pictures'}, {'@class': 'new', 'date': '2010', 'con': '1973', 'aut': 'C. Stella', 'tit': 'Johnny Porno', 'num': '39', '#text': 'Doing the tally count for the fuck movie he was sick and tired of already'}]","describing something obscene or pornographic, e.g.",adjective,fuck,1946,implied in,2010,Doing the tally count for the fuck movie he was sick and tired of already,fuck
