chrlbl,citations,definition,part_of_speech,word,first_citation_date,first_citation_text,last_citation_date,last_citation_text,family
1970s,"[{'@first': 'yes', 'date': '1976', 'con': '1942', 'aut': 'J. Lee', 'tit': 'Ninth Man', 'num': '162', '#text': 'She couldn’t accept the fact that they had simply engineered themselves a good old-fashioned fuckfest'}, {'date': '1993', 'aut': 'A. Rodriguez', 'tit': 'Spidertown', 'edn': '1994', 'num': '25', 'scaps': 'outloud', '#text': 'The fuckfest would begin, each trying to  the other'}, {'date': '1999', 'aut': 'J. Poller', 'tit': 'Reach', 'num': '17', '#text': 'For all our pagan fuckfests, when fully clad I wanted nothing to do with her'}, {'date': '2000', 'aut': 'Ronin', '#text': '‘Tokyo Terror’ [Internet] He just hoped that his parents didn’t come home early to find that their luxurious penthouse apartment was hosting a lesbian fuck-fest'}, {'@class': 'new', 'date': '2002', 'aut': 'C. Stella', 'tit': 'Jimmy Bench-Press', 'num': '9', '#text': 'And now sometimes they show up, rent two-three rooms together and have a fuck-fest'}, {'date': '2006', 'tit': 'www.privatehustler.com', '#text': '[Internet] British Fuckfest is back bigger better, harder and wetter. Five scenes cram packed with filthy British babes doing what they do best. Fucking sucking and drinking cum for fun'}, {'@class': 'new', 'date': '2011', 'aut': 'J.J. Connolly', 'tit': 'Viva La Madness', 'num': '272', '#text': 'After their fuckfest Jenna shipped back to New York'}]",an orgy,noun,fuckfest,1976,She couldn’t accept the fact that they had simply engineered themselves a good old-fashioned fuckfest,2011,After their fuckfest Jenna shipped back to New York,fuck
1990s+,"[{'@first': 'yes', 'date': '1989', 'aut': 'A. Ansen', 'tit': 'Contact Highs', 'num': '70', '#text': 'The fuckmobile’s undulating bloodstained canvas top'}, {'date': '1998', 'aut': 'M. Jacobson', 'tit': 'Everyone and No One', 'num': '6', '#text': 'I ate Starr in the back of the Chevy Suburban that Jimmy Dime had so delicately dubbed the fuckmobile. I ate her like I’d eat Princess Di'}, {'date': '2000', 'aut': 'N. Barlay', 'tit': 'Crumple Zone', 'num': '23', '#text': 'He doesn’t so much open the doors of his BMW 5.3 XRQZi fuel-injected fuckmobile as pull them aside like silk sheets'}, {'date': '2004', 'aut': 'Blackshaw & Crabbe', 'tit': 'New Perspectives on Sport', 'num': '105', '#text': 'His mate [...] calls his motor the ‘fuckmobile’ – ’cos he’s ‘had’ tons of birds in the back'}]",a car that improves one’s attractiveness to the opposite sex; thus a car used as a place for intercourse,noun,fuckmobile,1989,The fuckmobile’s undulating bloodstained canvas top,2004,His mate [...] calls his motor the ‘fuckmobile’ – ’cos he’s ‘had’ tons of birds in the back,fuck
1960s+,"[{'@first': 'yes', 'date': '1967', 'aut': 'P. Thomas', 'tit': 'Down These Mean Streets', 'edn': '1970', 'num': '77', 'i': 'Hey, cops, you’re supposed to say, ‘Halt in the name of the law.’ You ain’t playing fair, fuckos'}, {'date': '1976', 'aut': 'R. Price', 'tit': 'Blood Brothers', 'num': '243', '#text': '‘No sweat, fucko.’ Stony stormed out into the street'}, {'date': '1989', 'aut': 'Pileggi & Scorsese', 'tit': 'Goodfellas', 'num': '40', '#text': '[film script] Hey! Fucko! You want something?'}, {'date': '2006', 'aut': 'J. Grady', 'tit': 'DC Noir', 'num': '241', '#text': 'in Hey, fucko, I need the Senator'}]","a general term of address, with no specific overtones whether positive or negative",noun,fucko,1967,,2006,"in Hey, fucko, I need the Senator",fuck
2000s,"[{'@first': 'yes', 'date': '2001', 'aut': 'J. Stahl', 'tit': 'Plainclothes Naked', 'edn': '2002', 'num': '123', '#text': 'Some sick fuckos pancaked the sky-pilot and left him for dead'}, {'date': '2004', 'aut': 'E. Miller', 'tit': 'Brooklyn Noir', 'num': '112', 'i': 'Dummy fuck-o?', '#text': '‘Practicing’ in What about words like'}]",an unpleasant person,noun,fucko,2001,Some sick fuckos pancaked the sky-pilot and left him for dead,2004,‘Practicing’ in What about words like,fuck
1990s+,"[{'@class': 'new', '@first': 'yes', 'date': '1994', 'tit': 'newsgroup alt.music.alternative', '#text': '13 June [Internet] You worthless fucktard. Go crawl back under whatever stinking bigoted little rock you crawled out of'}, {'@class': 'new18A', 'date': '2006', 'tit': 'Tharunka', 'num': '19/1', '#text': '(Sydney) 9 Mar. Those who try to kill them are anally retentive fucktards'}, {'@class': 'new17C', 'date': '2009', 'aut': 'J. Birmingham', 'tit': 'Without Warning', 'num': '161', '#text': '‘Worthless fedayeen fucktards. Sometimes I think they shoot high and wide, praying to get fucking captured’'}, {'@class': 'new', 'date': '2010', 'aut': 'L. Redhead', 'tit': 'Thrill City', '#text': '[ebook] ‘Hey — fucktard!’ [...] A gunshot fractured the air'}]","an unpleasant individual, with an inference of stupidity",noun,fucktard,1994,13 June [Internet] You worthless fucktard. Go crawl back under whatever stinking bigoted little rock you crawled out of,2010,[ebook] ‘Hey — fucktard!’ [...] A gunshot fractured the air,fuck
mid-19C,"{'@class': 'new19C', '@first': 'yes', 'date': '1875', 'aut': 'E. Sellon', 'tit': 'New Epicurean', 'num': '10', '#text': 'Oh! the dear little feet, the fucktious shoes, the racy delectable legs, nothing could be finer'}",sexually stimulating,adjective,fucktious,1875,"Oh! the dear little feet, the fucktious shoes, the racy delectable legs, nothing could be finer",1875,"Oh! the dear little feet, the fucktious shoes, the racy delectable legs, nothing could be finer",fuck
1960s+,"[{'@class': 'new19B', 'date': '1969', 'aut': 'P. Manso', 'tit': 'Running against the Machine', 'num': '285', '#text': 'I asked Norman [Mailer] what he thought of their fuckability quotient'}, {'@class': 'new19B aut + cit', 'date': '1978', 'aut': 'T. Marenna', 'tit': 'Studio', 'num': '171', '#text': 'Julie Christie [...] exudes more sex (fuckability) than any actress around'}, {'@class': 'new19B aut + cit', 'date': '1984', 'aut': 'R. Boycott', 'tit': 'Nice Girl Like Me', 'num': '62', '#text': ""The closest the index came to mentioning women's liberation was the ‘Female Fuckability Test’""}, {'ante': '1990', 'aut': 'M. Ritt', 'src': 'Ritt & Miller', 'tit': 'Martin Ritt (1914–1990) Interviews', 'edn': '2003', 'num': '202', 'i': 'fuckability', '#text': 'in There are a lot of great actors who are not, never will be movie stars. Want to know what makes a movie star? It’s . It’s having what I call high fuckability'}, {'date': '1992', 'aut': 'M. Leyner', 'tit': 'Et Tu, Babe', 'edn': '1993', 'num': '126', '#text': 'I don’t think that those folks wrote to enhance their fuckability'}, {'date': '1999', 'tit': 'Guardian', 'num': '3', '#text': 'Rev. 15 Oct. I was told point blank that I had no ‘fuckability’ quotient'}, {'date': '2003', 'aut': 'G. Tate', 'tit': 'Midnight Lightning', 'num': '16', '#text': 'The apex of animal magnatism and fuckability in American pop is a skinny (white) guy with a screaming guitar'}, {'@class': 'new', 'date': '2012', 'tit': 'Guardian On Line', '#text': '16 Oct. [Internet] The very phrase ‘yummy mummy’ leaks bile, marking mothers on their fuckability and almost always sneeringly deployed'}, {'@class': 'new18D', 'date': '2017', 'aut': 'T. Spicer', 'tit': 'Good Girl Stripped Bare', 'num': '229', '#text': '‘Listen, girls, defamation law, contempt of court the inverted pyramid, they’re all important. But it counts for nothing without fuckability’'}]",sex appeal,noun,fuckability,1969,I asked Norman [Mailer] what he thought of their fuckability quotient,2017,"‘Listen, girls, defamation law, contempt of court the inverted pyramid, they’re all important. But it counts for nothing without fuckability’",fuck
late 19C+,"[{'@first': 'yes', 'date': '1888–94', 'aut': '‘Walter’', 'tit': 'My Secret Life', 'edn': '1966', 'num': '2253', '#text': 'XI How fine and firm and fuckable are these country wenches, what juicy cunts'}, {'@class': 'N331', 'date': '1889', 'aut': 'C. Deveureux', 'tit': 'Venus in India', 'num': '82', '#text': 'II I seem to be destined to see all the fuckable Selwyn cunts to-night!'}, {'date': '1896', 'aut': 'Farmer', 'tit': 'Vocabula Amatoria', 'edn': '1966', 'num': '137', 'scaps': 'Foutable', 'i': 'adj', '#text': ', . Desirable; ‘fuckable’'}, {'@class': 'new19C', 'circa': '1900', 'aut': '‘Ramrod’', 'tit': 'Nocturnal Meeting', 'num': '84', '#text': 'It was likely to be eminently fuckable for many a year yet'}, {'date': '1967–8', 'aut': 'Baker', 'tit': 'CUSS', 'num': '122', 'i': 'Fuckable', '#text': 'et al.  A sexually attractive person, female'}, {'date': '1974', 'aut': 'J. Lahr', 'tit': 'Hot to Trot', 'num': '15', '#text': '‘I’d like to dip my wick into that.’ ‘Fuckable.’'}, {'@class': 'N331', 'date': '1978', 'aut': 'L. Kramer', 'tit': 'Faggots', 'num': '45', '#text': 'Why was the same guy Hot and fuckable in a Pendleton and not in a Polo?'}, {'date': '1987', 'aut': 'S. Hite', 'tit': 'Hite Report on Male Sexuality', 'num': '111', '#text': 'They’re really nice and fuckable all the time, but when they grow old, they are not worth looking at'}, {'date': '1995', 'aut': 'C. Hiaasen', 'tit': 'Stormy Weather', 'num': '6', '#text': 'All the fuckable Kennedys travelled up to Hyannis'}, {'@class': 'N331', 'date': '2000', 'tit': 'Guardian', 'num': '8', '#text': 'Rev. 31 Mar. He’s gotta be fuckable'}, {'@class': 'N331', 'date': '2000', 'aut': 'W.T. Vollmann', 'tit': 'Royal Family', 'num': '510', '#text': 'Justin, do I look good? [...] You look fuckable, sure'}, {'date': '2004', 'aut': 'H. Walsh', 'tit': 'Brass', 'num': '21', '#text': 'And how a simple course of lazer treatment would [...] transform her from an unfuckable attractive lady to a fuckable stunner'}, {'@class': 'new', 'date': '2012', 'aut': 'J. Fagan', 'tit': 'Panopticon', 'edn': '2013', 'num': '48', '#text': '‘You are unbelievably fuckable,’ he says'}, {'@class': 'new18D', 'date': '2017', 'aut': 'T. Spicer', 'tit': 'Good Girl Stripped Bare', 'num': '229', '#text': '‘To make it in this game [i.e. TV], women have to be fuckable’'}]",sexually desirable,adjective,fuckable,1888,"XI How fine and firm and fuckable are these country wenches, what juicy cunts",2017,"‘To make it in this game [i.e. TV], women have to be fuckable’",fuck
1970s+,"{'@first': 'yes', 'date': '1972', 'aut': 'B. Rodgers', 'tit': 'Queens’ Vernacular', 'num': '89', 'b': 'fuckable', '#text': '1. willing to be ass-fucked'}",sexually available,adjective,fuckable,1972,1. willing to be ass-fucked,1972,1. willing to be ass-fucked,fuck
1980s+,"[{'@first': 'yes', 'date': '1981', 'aut': 'D. Jenkins', 'tit': 'Baja Okla.', 'num': '246', 'org': 'HDAS', '#text': 'He’s just a fuckaholic, is all he is'}, {'date': '1985', 'aut': 'R.R. Ward', 'tit': 'Fuckers', '#text': '[Internet] I was’t just a casual or social fucker. I was a Fuckaholic'}, {'date': '2002', 'aut': 'WC', '#text': '‘Flirt’ [lyrics] I got a problem, and it’s serious as cancer. / No matter what you call it baby I’m a fuckaholic'}]",one who is obsessed with having sexual relations,noun,fuckaholic,1981,"He’s just a fuckaholic, is all he is",2002,"‘Flirt’ [lyrics] I got a problem, and it’s serious as cancer. / No matter what you call it baby I’m a fuckaholic",fuck
1960s+,"{'@first': 'yes', 'date': '2002', 'tit': 'www.suze-centerfolds.com', '#text': '[Internet] Among so many other feathers in her cap was the web cam fuckathon with a lead performer in the rock band Motley Crue'}",a long sexual encounter or orgy,noun,fuckathon,2002,[Internet] Among so many other feathers in her cap was the web cam fuckathon with a lead performer in the rock band Motley Crue,2002,[Internet] Among so many other feathers in her cap was the web cam fuckathon with a lead performer in the rock band Motley Crue,fuck
mid–late 17C,"{'@first': 'yes', 'date': '1663', 'aut': 'Head', 'tit': 'Hic et Ubique', 'num': 'I vi', '#text': 'Fuy by St. Patrick agra, he put de fuckation upon me weef'}",sexual intercourse,noun,fuckation,1663,"Fuy by St. Patrick agra, he put de fuckation upon me weef",1663,"Fuy by St. Patrick agra, he put de fuckation upon me weef",fuck
1950s+,"[{'@class': 'new19A', '@first': 'yes', 'date': '1950', 'tit': 'Crime Smashers', 'num': '27', '#text': 'Oct. [comic] You’ll have to confess you were indulging in fuckery with a boy friend!'}, {'@class': 'new18C us', 'date': '1961', 'aut': 'J. Ashmead', 'tit': 'The Mountain and the Feather', 'num': '132', '#text': 'By definition, homosexuals did not speak endlessly and monotonously of the drab arts of fuckery'}, {'@class': 'new18C aus', 'date': '1969', 'tit': 'Nation', 'num': '272', '#text': '260-83 He is testing his characters right the way through [...] following them assiduously through the pleasures. which mostly read like ordeals of fuckery in Paddo bedrooms'}, {'@class': 'new18C', 'date': '1974', 'tit': 'New Society', 'num': '170', '#text': '29 Now, although she assesses herself a unique phoenix of fuckery, Ms [Linda] Lovelace does only what any accomplished whore is expected to do'}, {'@class': 'new18C uk', 'date': '1975', 'tit': 'London Mag.', 'num': '32', '#text': '15 No one must be kept outside the game: child molesters, voyeurs, pederasts, potent and impotent, young and old, it is a free-for-all; everyone gets the gift of a ticket to enter the mindless world of indiscriminate fuckery'}]","an act of sex performed by one or more couples, thus an orgy",noun,fuckery,1950,Oct. [comic] You’ll have to confess you were indulging in fuckery with a boy friend!,1975,"15 No one must be kept outside the game: child molesters, voyeurs, pederasts, potent and impotent, young and old, it is a free-for-all; everyone gets the gift of a ticket to enter the mindless world of indiscriminate fuckery",fuck
late 19C+,"[{'@first': 'yes', 'date': '1890–1904', 'aut': 'Farmer & Henley', 'tit': 'Sl. and Its Analogues'}, {'date': '1969', 'aut': '‘Iceberg Slim’', 'tit': 'Mama Black Widow', 'num': '199', '#text': 'She’s acting fuckish tonight'}]",sexually forward,adjective,fuckish,1890,,1969,She’s acting fuckish tonight,fuck
mid-19C+,"[{'@class': 'new19C', '@first': 'yes', 'date': '1870', 'tit': 'Cythera’s Hymnal', 'num': '61', '#text': 'She’s spend and fart and shudder and bound, / My fucksome little Sally'}, {'@class': 'new19C', 'circa': '1900', 'aut': '‘Ramrod’', 'tit': 'Nocturnal Meeting', 'num': '41', '#text': 'Here’s a couple of loving and most fucksome women'}, {'date': '1937–84', 'aut': 'Partridge', 'tit': 'DSUE', 'edn': '1984', 'num': '443/1', '#text': 'C.19–20'}, {'date': '2002', 'aut': 'D. Goode', 'tit': 'Goodheart and The Pagan Princess', '#text': 'Ch. 9 [Internet] My eyes roved, picking out the more voluptuous and fucksome members of the crowd—those with firm, youthful tits and lightly-furred slits'}]","of a woman, sexually desirable",adjective,fucksome,1870,"She’s spend and fart and shudder and bound, / My fucksome little Sally",2002,"Ch. 9 [Internet] My eyes roved, picking out the more voluptuous and fucksome members of the crowd—those with firm, youthful tits and lightly-furred slits",fuck
None,"{'date': '1902', 'aut': 'G.R. Bacchus', 'tit': 'Confessions of Nemesis Hunt', 'num': '2', '#text': 'When you start talking of fucksome drinks [...] take one quart bottle of champagne and four eggs. Divide bottle into four large glasses, break egg in each, and drink, then fuck!'}","of an inanimate object, sexually arousing",adjective,fucksome,1902,"When you start talking of fucksome drinks [...] take one quart bottle of champagne and four eggs. Divide bottle into four large glasses, break egg in each, and drink, then fuck!",1902,"When you start talking of fucksome drinks [...] take one quart bottle of champagne and four eggs. Divide bottle into four large glasses, break egg in each, and drink, then fuck!",fuck
late 17C; late 19C,"[{'@first': 'yes', 'date': '1676–84', 'tit': 'British Museum Additional Mss', 'num': '34362.47', '#text': '‘Acrostick’   Each F–ster now this title’s grown so mean Rules his dull Whore & calls her Mazareen'}, {'@class': 'N331', 'ante': '1680', 'tit': 'Harleian Mss.', 'num': '7312.89', '#text': '‘Advice to a C-monger’  Fucksters you that would be happy have a care that C-t don’t Clap yee'}, {'@class': 'N331', 'circa': '1682', 'tit': 'Harleian Mss.', 'num': '6913.257', '#text': '‘Letter’  For want of Fucksters to increase her Pox Shee locks up Skipperitt in her Dressing Box'}, {'@class': 'N331', 'circa': '1682', 'tit': 'Harleian Mss.', 'num': '6913.6', '#text': '‘Satyr’  Poor nauseous Fool a Fuckster fain wou’d have To send like Isham Shanker’d to his Grave'}, {'@class': 'N331', 'circa': '1686', 'tit': 'Harleian Mss.', 'num': '7315.148', 'sup': ['v', 't'], '#text': '‘Satyr on the Parsons’   As well as S Peter and Paul, Poor Fucksters will all goe to Heav’n'}, {'date': '1687', 'aut': 'Wilson', 'tit': 'Court Satires of the Restoration', 'edn': '1976', 'num': '185', '#text': '‘Lovers’ Session’ in It’s unjust the fair sexes’ pride / Should run any risk with a fuckster untried'}, {'@class': 'new', 'date': '1867', 'aut': 'E. Sellon', 'tit': 'Ups & Downs of Life', 'edn': '1996', 'num': '110', '#text': 'Gentlemen, I leave such illicit pleasures to the clergy; as for me, I’m a mere fuckster. I like women, and I have them'}, {'@class': 'new', 'date': '1868', 'tit': 'The Index Expurgatorius of Martial', 'num': '33', '#text': '[trans.] You gamahuche, you do not poke my woman, and you brag about it as if you were her gallant and a fuckster'}, {'date': '1881', 'tit': 'Amatory Experiences of a Surgeon', 'num': '13', '#text': 'A tremendous lunge from the now dreadfully excited fuckster overturned the obstacle with a loud crash'}, {'date': '1888–94', 'aut': '‘Walter’', 'tit': 'My Secret Life', 'edn': '1966', 'num': '552', '#text': 'III She was a glorious fuckster; her cunt was tight inside, and yet so elastic as not to hurt or pinch'}, {'@class': 'new19C', 'date': '1892', 'aut': '‘Lais Lovecock’', 'tit': 'Bagnio Misc.', 'num': '30', '#text': 'There was a house directly opposite to mine in which lived my former fuckster [...] He had taken the precaution to hide his light'}, {'@class': 'new', 'date': '1902', 'aut': 'Baumann', 'tit': 'Londinismen', 'num': '70/2', '#text': 'fuckster P[opulär] unzüchtig: Ficker'}, {'@class': 'new', 'circa': '1935', 'aut': 'Jem', 'tit': ['Wide Open', 'Essential Guide to Erotic Literature'], 'src': 'C.J. Scheiner', 'edn': '1996', 'num': '242', '#text': 'in I As already explained, the voyeurs are persons, male or female, who do not care to be active participants in the party, but are content, and willing to pay, to assist passively at the spectacle offered by the real fucksters'}, {'@class': 'new', 'date': '1990', 'tit': 'Footlicker', 'num': '62', '#text': 'Rocked her shoulders and threw back her sweat-drenched ponytail out at Marlborough’s fuckstering face'}]","a promiscuous man; occas. woman; thus , copulating",noun,fuckster,1676,‘Acrostick’   Each F–ster now this title’s grown so mean Rules his dull Whore & calls her Mazareen,1990,Rocked her shoulders and threw back her sweat-drenched ponytail out at Marlborough’s fuckstering face,fuck
None,"[{'@class': 'new', '@first': 'yes', 'date': '1868', 'tit': 'The Index Expurgatorius of Martial', 'num': '5', '#text': 'Fututor, ‘a fuckster.’ There is an auxesis in the term ‘fuckster’, applied to a woman, who ought to be called a ‘fuckstress’, but Martial calls her ‘a fuckster’, to brand her turpitude more signally; and this term is specially applied to tribades by Martial, for he constantly says of them that they ‘fuck’.'}, {'date': '1999', 'tit': ['Roger’s Profanisaurus 3', 'Viz'], 'num': '9', 'b': 'Covent Garden nun', 'i': ['n', 'fuckstress', 'Fulham virgin'], '#text': 'in  98 Oct. . A ; a . A prostitute'}]",a prostitute,noun,fuckstress,1868,"Fututor, ‘a fuckster.’ There is an auxesis in the term ‘fuckster’, applied to a woman, who ought to be called a ‘fuckstress’, but Martial calls her ‘a fuckster’, to brand her turpitude more signally; and this term is specially applied to tribades by Martial, for he constantly says of them that they ‘fuck’.",1999,in  98 Oct. . A ; a . A prostitute,fuck
None,"[{'@class': 'new', '@first': 'yes', 'date': '1883', 'tit': 'Boudoir', 'edn': '1984', 'num': '217', '#text': 'VI I’m spending...I’m coming...I spend!’ ‘And so do I...Ah! I can’t keep up...any longer...my darling!...my FUCKSTRESS...I...I spend...take it all...take all my SPUNK!'}, {'date': '1884', 'tit': 'Randiana', 'num': '127', '#text': 'What a deep-drawn sigh of delight, my fresh fuckstress gave, as she heaved up her buttocks and felt my charger rush up to the very extremity of her burning sheath'}, {'date': '1888–94', 'aut': '‘Walter’', 'tit': 'My Secret Life', 'edn': '1966', 'num': '894', '#text': 'V As a fuckstress she was perfection. Rarely have I found such an exquisite fitting cunt'}, {'@class': 'new', 'date': '1899', 'tit': 'Horn Book: A Girl’s Guide to the Knowledge of Good and Evil', 'num': '71', '#text': 'Dialogue III The man need not fear that his fuckstress will fall backwards, and if she did, she would fall upon him and not hurt herself'}, {'date': '1941', 'aut': 'G. Legman', 'tit': 'Limerick', 'edn': '1953', 'num': '58', '#text': 'in A talented Fuckstress, Miss Chisholm, / Was renowned for her fine paroxysm'}, {'@class': 'new', 'date': '1990', 'tit': 'Footlicker', 'num': '77', '#text': 'Verushka and I will be waiting for your report on that little psychofuckstress'}]",a female sexual sophisticate,noun,fuckstress,1883,VI I’m spending...I’m coming...I spend!’ ‘And so do I...Ah! I can’t keep up...any longer...my darling!...my FUCKSTRESS...I...I spend...take it all...take all my SPUNK!,1990,Verushka and I will be waiting for your report on that little psychofuckstress,fuck
1960s+,"[{'@class': 'uk', '@first': 'yes', 'date': '1969', 'aut': 'J. Nuttall', 'tit': 'Pig', 'num': '50', '#text': '‘Silly old fuckbag,’ I thought. ‘Completely off her head.’'}, {'date': '1979', 'aut': 'J. Morrow', 'tit': 'Confessions of Proinsias O’Toole', 'num': '160', '#text': 'The unceasing obscene clangour of her tongue (‘Putrefying fuckbag!’ – just one gem)'}, {'date': '1993', 'con': '1945', 'aut': 'S. McAughtry', 'tit': 'Touch and Go', 'num': '54', '#text': 'I suppose the fuckpots sent you out to the Far East as well'}, {'date': '1993', 'aut': 'I. Welsh', 'tit': 'Trainspotting', 'num': '255', '#text': 'Then she discovered that the rapist fuckbag was HIV'}, {'@class': 'uk', 'date': '2002', 'aut': 'P. Smith', 'tit': 'Aleister in Wonderland', 'num': '46', '#text': 'You lame old fuckbag. You be naggin’ and naggin’. [...] Draggin’ around yo sack o’ potato ass, ya raspy old fuckbag'}, {'@class': 'new18A', 'date': '2006', 'tit': 'Tharunka', 'num': '7/2', '#text': '(Sydney) 6 Oct. These fuck-bags were encouraging women who wanted to live to ‘give it up’ to a man in a timely manner, but where marriage could be avoided, so the women would avoid being sacrificed but ‘lost’ and the men ‘won’'}, {'@class': 'new19B', 'date': '2019', 'aut': 'S.M. Jones', 'tit': 'Lives Laid Away', 'i': 'ever', '#text': '[ebook] ‘Don’t  have that annoying fuck-bag David Goddamn Baker call my office again!’'}]","a general term of contempt for an unpleasant, disgusting person",compound,fuckbag,1969,"‘Silly old fuckbag,’ I thought. ‘Completely off her head.’",2019,[ebook] ‘Don’t  have that annoying fuck-bag David Goddamn Baker call my office again!’,fuck
,"[{'@first': 'yes', 'date': '1970', 'aut': 'W.J. Craddock', 'tit': 'Be Not Content', 'num': '75', '#text': 'What sort of a ruined mind would want to be a fuckbag cop?'}, {'date': '1995', 'aut': 'R.M. Wilson', 'tit': 'Ripley Bogle', 'num': '100', '#text': 'St Mary’s, a fuckbag girls’ school that tries hard to posh it out on the Upper Falls and fails badly'}]",attrib. use of sense 1,compound,fuckbag,1970,What sort of a ruined mind would want to be a fuckbag cop?,1995,"St Mary’s, a fuckbag girls’ school that tries hard to posh it out on the Upper Falls and fails badly",fuck
,"[{'@class': 'new17C', '@first': 'yes', 'date': '1993', 'aut': 'B. Moore', 'tit': 'Lex. Cadet Jargon', 'num': '151/2', 'b': 'fuck bag', '#text': '- a woman believed by cadets to be a good fuck and/or readily available for a fuck'}, {'date': '2002', 'aut': 'J. Flint', 'tit': '50 Ways to Magic America', 'num': '134', '#text': 'He’d told her how she was his little fuckbag and how he wanted her to slide her cunt right up to his nutbag while he sat in front of his computer screen'}, {'date': '2006', 'aut': 'M. Philbin', 'tit': 'Jane’s Game', 'num': '60', '#text': 'Makes me sick just to think of it. You syrupy lap dog. Well, you’ve had your last of me. [...] You can find some other Fuck Bag'}]",a woman seen as no more than a sex object,compound,fuckbag,1993,- a woman believed by cadets to be a good fuck and/or readily available for a fuck,2006,"Makes me sick just to think of it. You syrupy lap dog. Well, you’ve had your last of me. [...] You can find some other Fuck Bag",fuck
1990s+,"{'@first': 'yes', 'date': '1996', 'aut': 'S. Frank', 'tit': 'Get Shorty', '#text': '[film script] Hey, fuckball, I don’t need your permission. L.A.’s an open city'}",a general derog. term,compound,fuckball,1996,"[film script] Hey, fuckball, I don’t need your permission. L.A.’s an open city",1996,"[film script] Hey, fuckball, I don’t need your permission. L.A.’s an open city",fuck
